Order ID,Date,Order Date Text,Year,Product,Category,State,Region,Region (Messy),City-State,Country,Quantity Sold,Cost Price,Selling Price,Discount Flag,Salesperson,Target Margin %
1001,01/01/2021,2021/01/01,2021,Product 1,Electronics,New York,North,  North ,"New York City, New York",USA,,,ERROR,Yes,alex,0.20
1001,01/01/2021,01-01-2021,2021,Product 1,Electronics,Pennsylvania,North,  North ,"Philadelphia, Pennsylvania",USA,24.0,600.0,768.58,No,Brooke,0.25
1002,01/01/2021,01-01-2021,2021,Product 1,Electronics,Texas,South,  South ,"Houston, Texas",USA,29.0,725.0,897.15,Unknown,CHRIS,0.30
1002,01/01/2021,01-01-2021,2021,Product 1,Electronics,Georgia,South,  South ,"Atlanta, Georgia",USA,27.0,675.0,813.56,Yes,Drew,0.15
1003,01/01/2021,01-01-2021,2021,Product 1,Electronics,Florida,East,  East ,"Miami, Florida",USA,30.0,750.0,966.61,No,Elliot,0.20
1003,01/01/2021,01-01-2021,2021,Product 1,Electronics,North Carolina,East,  East ,"New York City, North Carolina",USA,16.0,400.0,480.07,Unknown,,0.25
1004,01/01/2021,01-01-2021,2021,Product 1,Electronics,California,West,  West ,"Philadelphia, California",USA,19.0,475.0,613.76,Yes,alex,0.30
1004,01/01/2021,01-01-2021,2021,Product 1,Electronics,Washington,West,  West ,"Houston, Washington",USA,29.0,725.0,1078.97,No,Brooke,0.15
1005,01/01/2021,01-01-2021,2021,Product 2,Electronics,New York,North,  North ,"Atlanta, New York",USA,22.0,330.0,453.5,Unknown,CHRIS,0.20
1005,01/01/2021,01-01-2021,2021,Product 2,Electronics,Pennsylvania,North,  North ,"Miami, Pennsylvania",USA,16.0,240.0,339.19,Yes,Drew,0.25
1006,01/01/2021,2021/01/01,2021,Product 2,Electronics,Texas,South,  South ,"New York City, Texas",USA,33.0,495.0,596.94,No,Elliot,0.30
1006,01/01/2021,01-01-2021,2021,Product 2,Electronics,Georgia,South,  South ,"Philadelphia, Georgia",USA,23.0,345.0,400.04,Unknown,,0.15
1007,01/01/2021,01-01-2021,2021,Product 2,Electronics,Florida,East,  East ,"Houston, Florida",USA,31.0,465.0,553.58,Yes,alex,0.20
1007,01/01/2021,01-01-2021,2021,Product 2,Electronics,North Carolina,East,  East ,"Atlanta, North Carolina",USA,18.0,270.0,335.04,No,Brooke,0.25
1008,01/01/2021,01-01-2021,2021,Product 2,Electronics,California,West,  West ,"Miami, California",USA,27.0,405.0,606.51,Unknown,CHRIS,0.30
1008,01/01/2021,01-01-2021,2021,Product 2,Electronics,Washington,West,  West ,"New York City, Washington",USA,31.0,465.0,657.25,Yes,Drew,0.15
1009,01/01/2021,01-01-2021,2021,Product 3,Electronics,New York,North,  North ,"Philadelphia, New York",USA,19.0,950.0,1251.34,No,Elliot,0.20
1009,01/01/2021,01-01-2021,2021,Product 3,Electronics,Pennsylvania,North,  North ,"Houston, Pennsylvania",USA,20.0,1000.0,1375.44,Unknown,,0.25
1010,01/01/2021,01-01-2021,2021,Product 3,Electronics,Texas,South,  South ,"Atlanta, Texas",USA,35.0,1750.0,2199.89,Yes,alex,0.30
1010,01/01/2021,01-01-2021,2021,Product 3,Electronics,Georgia,South,  South ,"Miami, Georgia",USA,30.0,1500.0,2107.19,No,Brooke,0.15
1011,01/01/2021,2021/01/01,2021,Product 3,Electronics,Florida,East,  East ,"New York City, Florida",USA,25.0,1250.0,1434.6,Unknown,CHRIS,0.20
1011,01/01/2021,01-01-2021,2021,Product 3,Electronics,North Carolina,East,  East ,"Philadelphia, North Carolina",USA,26.0,1300.0,1700.78,Yes,Drew,0.25
1012,01/01/2021,01-01-2021,2021,Product 3,Electronics,California,West,  West ,"Houston, California",USA,23.0,1150.0,1631.81,No,Elliot,0.30
1012,01/01/2021,01-01-2021,2021,Product 3,Electronics,Washington,West,  West ,"Atlanta, Washington",USA,25.0,1250.0,1734.89,Unknown,,0.15
1013,01/01/2021,01-01-2021,2021,Product 4,Clothing,New York,North,  North ,"Miami, New York",USA,22.0,55.0,61.37,Yes,alex,0.20
1013,01/01/2021,01-01-2021,2021,Product 4,Clothing,Pennsylvania,North,  North ,"New York City, Pennsylvania",USA,21.0,52.5,63.43,No,Brooke,0.25
1014,01/01/2021,01-01-2021,2021,Product 4,Clothing,Texas,South,  South ,"Philadelphia, Texas",USA,19.0,47.5,52.5,Unknown,CHRIS,0.30
1014,01/01/2021,01-01-2021,2021,Product 4,Clothing,Georgia,South,  South ,"Houston, Georgia",USA,28.0,70.0,95.39,Yes,Drew,0.15
1015,01/01/2021,01-01-2021,2021,Product 4,Clothing,Florida,East,  East ,"Atlanta, Florida",USA,29.0,72.5,89.29,No,Elliot,0.20
1015,01/01/2021,01-01-2021,2021,Product 4,Clothing,North Carolina,East,  East ,"Miami, North Carolina",USA,30.0,75.0,83.04,Unknown,,0.25
1016,01/01/2021,2021/01/01,2021,Product 4,Clothing,California,West,  West ,"New York City, California",USA,28.0,70.0,89.89,Yes,alex,0.30
1016,01/01/2021,01-01-2021,2021,Product 4,Clothing,Washington,West,  West ,"Philadelphia, Washington",USA,20.0,50.0,73.75,No,Brooke,0.15
1017,01/01/2021,01-01-2021,2021,Product 5,Clothing,New York,North,  North ,"Houston, New York",USA,25.0,37.5,51.89,Unknown,CHRIS,0.20
1017,01/01/2021,01-01-2021,2021,Product 5,Clothing,Pennsylvania,North,  North ,"Atlanta, Pennsylvania",USA,30.0,45.0,52.54,Yes,Drew,0.25
1018,01/01/2021,01-01-2021,2021,Product 5,Clothing,Texas,South,  South ,"Miami, Texas",USA,22.0,33.0,44.26,No,Elliot,0.30
1018,01/01/2021,01-01-2021,2021,Product 5,Clothing,Georgia,South,  South ,"New York City, Georgia",USA,30.0,45.0,62.08,Unknown,,0.15
1019,01/01/2021,01-01-2021,2021,Product 5,Clothing,Florida,East,  East ,"Philadelphia, Florida",USA,29.0,43.5,59.66,Yes,alex,0.20
1019,01/01/2021,01-01-2021,2021,Product 5,Clothing,North Carolina,East,  East ,"Houston, North Carolina",USA,,28.5,41.94,No,Brooke,0.25
1020,01/01/2021,01-01-2021,2021,Product 5,Clothing,California,West,  West ,"Atlanta, California",USA,17.0,25.5,33.88,Unknown,CHRIS,0.30
1020,01/01/2021,01-01-2021,2021,Product 5,Clothing,Washington,West,  West ,"Miami, Washington",USA,31.0,46.5,60.78,Yes,Drew,0.15
1021,01/01/2021,2021/01/01,2021,Product 6,Clothing,New York,North,  North ,"New York City, New York",USA,30.0,120.0,143.93,No,Elliot,0.20
1021,01/01/2021,01-01-2021,2021,Product 6,Clothing,Pennsylvania,North,  North ,"Philadelphia, Pennsylvania",USA,24.0,96.0,123.07,Unknown,,0.25
1022,01/01/2021,01-01-2021,2021,Product 6,Clothing,Texas,South,  South ,"Houston, Texas",USA,32.0,128.0,162.73,Yes,alex,0.30
1022,01/01/2021,01-01-2021,2021,Product 6,Clothing,Georgia,South,  South ,"Atlanta, Georgia",USA,27.0,108.0,135.66,No,Brooke,0.15
1023,01/01/2021,01-01-2021,2021,Product 6,Clothing,Florida,East,  East ,"Miami, Florida",USA,22.0,88.0,122.67,Unknown,CHRIS,0.20
1023,01/01/2021,01-01-2021,2021,Product 6,Clothing,North Carolina,East,  East ,"New York City, North Carolina",USA,34.0,136.0,164.65,Yes,Drew,0.25
1024,01/01/2021,01-01-2021,2021,Product 6,Clothing,California,West,  West ,"Philadelphia, California",USA,24.0,96.0,116.29,No,Elliot,0.30
1024,01/01/2021,01-01-2021,2021,Product 6,Clothing,Washington,West,  West ,"Houston, Washington",USA,28.0,112.0,166.58,Unknown,,0.15
1025,01/01/2021,01-01-2021,2021,Product 7,Home Goods,New York,North,  North ,"Atlanta, New York",USA,33.0,330.0,412.9,Yes,alex,0.20
1025,01/01/2021,01-01-2021,2021,Product 7,Home Goods,Pennsylvania,North,  North ,"Miami, Pennsylvania",USA,27.0,270.0,384.56,No,Brooke,0.25
1026,01/01/2021,2021/01/01,2021,Product 7,Home Goods,Texas,South,  South ,"New York City, Texas",USA,23.0,230.0,342.55,Unknown,CHRIS,0.30
1026,01/01/2021,01-01-2021,2021,Product 7,Home Goods,Georgia,South,  South ,"Philadelphia, Georgia",USA,20.0,200.0,297.23,Yes,Drew,0.15
1027,01/01/2021,01-01-2021,2021,Product 7,Home Goods,Florida,East,  East ,"Houston, Florida",USA,31.0,310.0,435.61,No,Elliot,0.20
1027,01/01/2021,01-01-2021,2021,Product 7,Home Goods,North Carolina,East,  East ,"Atlanta, North Carolina",USA,25.0,,330.75,Unknown,,0.25
1028,01/01/2021,01-01-2021,2021,Product 7,Home Goods,California,West,  West ,"Miami, California",USA,23.0,230.0,314.96,Yes,alex,0.30
1028,01/01/2021,01-01-2021,2021,Product 7,Home Goods,Washington,West,  West ,"New York City, Washington",USA,34.0,340.0,375.31,No,Brooke,0.15
1029,01/01/2021,01-01-2021,2021,Product 8,Home Goods,New York,North,  North ,"Philadelphia, New York",USA,27.0,202.5,292.27,Unknown,CHRIS,0.20
1029,01/01/2021,01-01-2021,2021,Product 8,Home Goods,Pennsylvania,North,  North ,"Houston, Pennsylvania",USA,23.0,172.5,207.27,Yes,Drew,0.25
1030,01/01/2021,01-01-2021,2021,Product 8,Home Goods,Texas,South,  South ,"Atlanta, Texas",USA,17.0,127.5,141.31,No,Elliot,0.30
1030,01/01/2021,01-01-2021,2021,Product 8,Home Goods,Georgia,South,  South ,"Miami, Georgia",USA,33.0,247.5,320.42,Unknown,,0.15
1031,01/01/2021,2021/01/01,2021,Product 8,Home Goods,Florida,East,  East ,"New York City, Florida",USA,26.0,195.0,247.61,Yes,alex,0.20
1031,01/01/2021,01-01-2021,2021,Product 8,Home Goods,North Carolina,East,  East ,"Philadelphia, North Carolina",USA,32.0,240.0,328.68,No,Brooke,0.25
1032,01/01/2021,01-01-2021,2021,Product 8,Home Goods,California,West,  West ,"Houston, California",USA,17.0,127.5,157.05,Unknown,CHRIS,0.30
1032,01/01/2021,01-01-2021,2021,Product 8,Home Goods,Washington,West,  West ,"Atlanta, Washington",USA,17.0,127.5,151.59,Yes,Drew,0.15
1033,01/01/2021,01-01-2021,2021,Product 9,Home Goods,New York,North,  North ,"Miami, New York",USA,18.0,90.0,114.62,No,Elliot,0.20
1033,01/01/2021,01-01-2021,2021,Product 9,Home Goods,Pennsylvania,North,  North ,"New York City, Pennsylvania",USA,26.0,130.0,183.31,Unknown,,0.25
1034,01/01/2021,01-01-2021,2021,Product 9,Home Goods,Texas,South,  South ,"Philadelphia, Texas",USA,27.0,135.0,170.1,Yes,alex,0.30
1034,01/01/2021,01-01-2021,2021,Product 9,Home Goods,Georgia,South,  South ,"Houston, Georgia",USA,26.0,130.0,194.26,No,Brooke,0.15
1035,01/01/2021,01-01-2021,2021,Product 9,Home Goods,Florida,East,  East ,"Atlanta, Florida",USA,17.0,85.0,123.47,Unknown,CHRIS,0.20
1035,01/01/2021,01-01-2021,2021,Product 9,Home Goods,North Carolina,East,  East ,"Miami, North Carolina",USA,28.0,140.0,180.05,Yes,Drew,0.25
1036,01/01/2021,2021/01/01,2021,Product 9,Home Goods,California,West,  West ,"New York City, California",USA,28.0,140.0,195.77,No,Elliot,0.30
1036,01/01/2021,01-01-2021,2021,Product 9,Home Goods,Washington,West,  West ,"Philadelphia, Washington",USA,32.0,160.0,188.4,Unknown,,0.15
1037,01/01/2021,01-01-2021,2021,Product 10,Home Goods,New York,North,  North ,"Houston, New York",USA,30.0,375.0,494.04,Yes,alex,0.20
1037,01/01/2021,01-01-2021,2021,Product 10,Home Goods,Pennsylvania,North,  North ,"Atlanta, Pennsylvania",USA,21.0,262.5,382.33,No,Brooke,0.25
1038,01/01/2021,01-01-2021,2021,Product 10,Home Goods,Texas,South,  South ,"Miami, Texas",USA,,300.0,379.37,Unknown,CHRIS,0.30
1038,01/01/2021,01-01-2021,2021,Product 10,Home Goods,Georgia,South,  South ,"New York City, Georgia",USA,27.0,337.5,488.19,Yes,Drew,0.15
1039,01/01/2021,01-01-2021,2021,Product 10,Home Goods,Florida,East,  East ,"Philadelphia, Florida",USA,27.0,337.5,434.72,No,Elliot,0.20
1039,01/01/2021,01-01-2021,2021,Product 10,Home Goods,North Carolina,East,  East ,"Houston, North Carolina",USA,29.0,362.5,528.78,Unknown,,0.25
1040,01/01/2021,01-01-2021,2021,Product 10,Home Goods,California,West,  West ,"Atlanta, California",USA,25.0,312.5,378.03,Yes,alex,0.30
1040,01/01/2021,01-01-2021,2021,Product 10,Home Goods,Washington,West,  West ,"Miami, Washington",USA,19.0,237.5,267.32,No,Brooke,0.15
1041,01/02/2021,2021/02/01,2021,Product 1,Electronics,New York,North,  North ,"New York City, New York",USA,20.0,500.0,552.03,Unknown,CHRIS,0.20
1041,01/02/2021,01-02-2021,2021,Product 1,Electronics,Pennsylvania,North,  North ,"Philadelphia, Pennsylvania",USA,19.0,475.0,638.15,Yes,Drew,0.25
1042,01/02/2021,01-02-2021,2021,Product 1,Electronics,Texas,South,  South ,"Houston, Texas",USA,21.0,525.0,698.4,No,Elliot,0.30
1042,01/02/2021,01-02-2021,2021,Product 1,Electronics,Georgia,South,  South ,"Atlanta, Georgia",USA,35.0,875.0,1011.11,Unknown,,0.15
1043,01/02/2021,01-02-2021,2021,Product 1,Electronics,Florida,East,  East ,"Miami, Florida",USA,24.0,600.0,797.96,Yes,alex,0.20
1043,01/02/2021,01-02-2021,2021,Product 1,Electronics,North Carolina,East,  East ,"New York City, North Carolina",USA,25.0,625.0,879.03,No,Brooke,0.25
1044,01/02/2021,01-02-2021,2021,Product 1,Electronics,California,West,  West ,"Philadelphia, California",USA,18.0,450.0,603.22,Unknown,CHRIS,0.30
1044,01/02/2021,01-02-2021,2021,Product 1,Electronics,Washington,West,  West ,"Houston, Washington",USA,35.0,875.0,1185.54,Yes,Drew,0.15
1045,01/02/2021,01-02-2021,2021,Product 2,Electronics,New York,North,  North ,"Atlanta, New York",USA,28.0,420.0,530.62,No,Elliot,0.20
1045,01/02/2021,01-02-2021,2021,Product 2,Electronics,Pennsylvania,North,  North ,"Miami, Pennsylvania",USA,17.0,255.0,334.53,Unknown,,0.25
1046,01/02/2021,2021/02/01,2021,Product 2,Electronics,Texas,South,  South ,"New York City, Texas",USA,22.0,330.0,432.96,Yes,alex,0.30
1046,01/02/2021,01-02-2021,2021,Product 2,Electronics,Georgia,South,  South ,"Philadelphia, Georgia",USA,35.0,525.0,613.38,No,Brooke,0.15
1047,01/02/2021,01-02-2021,2021,Product 2,Electronics,Florida,East,  East ,"Houston, Florida",USA,25.0,375.0,437.28,Unknown,CHRIS,0.20
1047,01/02/2021,01-02-2021,2021,Product 2,Electronics,North Carolina,East,  East ,"Atlanta, North Carolina",USA,22.0,330.0,393.68,Yes,Drew,0.25
1048,01/02/2021,01-02-2021,2021,Product 2,Electronics,California,West,  West ,"Miami, California",USA,18.0,270.0,352.34,No,Elliot,0.30
1048,01/02/2021,01-02-2021,2021,Product 2,Electronics,Washington,West,  West ,"New York City, Washington",USA,21.0,315.0,429.0,Unknown,,0.15
1049,01/02/2021,01-02-2021,2021,Product 3,Electronics,New York,North,  North ,"Philadelphia, New York",USA,22.0,1100.0,1327.81,Yes,alex,0.20
1049,01/02/2021,01-02-2021,2021,Product 3,Electronics,Pennsylvania,North,  North ,"Houston, Pennsylvania",USA,16.0,800.0,999.83,No,Brooke,0.25
1050,01/02/2021,01-02-2021,2021,Product 3,Electronics,Texas,South,  South ,"Atlanta, Texas",USA,18.0,900.0,1177.19,Unknown,CHRIS,0.30
1050,01/02/2021,01-02-2021,2021,Product 3,Electronics,Georgia,South,  South ,"Miami, Georgia",USA,32.0,1600.0,2339.69,Yes,Drew,0.15
1051,01/02/2021,2021/02/01,2021,Product 3,Electronics,Florida,East,  East ,"New York City, Florida",USA,33.0,1650.0,1991.17,No,Elliot,0.20
1051,01/02/2021,01-02-2021,2021,Product 3,Electronics,North Carolina,East,  East ,"Philadelphia, North Carolina",USA,28.0,1400.0,ERROR,Unknown,,0.25
1052,01/02/2021,01-02-2021,2021,Product 3,Electronics,California,West,  West ,"Houston, California",USA,35.0,1750.0,2293.01,Yes,alex,0.30
1052,01/02/2021,01-02-2021,2021,Product 3,Electronics,Washington,West,  West ,"Atlanta, Washington",USA,34.0,1700.0,2485.29,No,Brooke,0.15
1053,01/02/2021,01-02-2021,2021,Product 4,Clothing,New York,North,  North ,"Miami, New York",USA,27.0,67.5,100.8,Unknown,CHRIS,0.20
1053,01/02/2021,01-02-2021,2021,Product 4,Clothing,Pennsylvania,North,  North ,"New York City, Pennsylvania",USA,16.0,40.0,49.31,Yes,Drew,0.25
1054,01/02/2021,01-02-2021,2021,Product 4,Clothing,Texas,South,  South ,"Philadelphia, Texas",USA,26.0,,76.12,No,Elliot,0.30
1054,01/02/2021,01-02-2021,2021,Product 4,Clothing,Georgia,South,  South ,"Houston, Georgia",USA,33.0,82.5,96.16,Unknown,,0.15
1055,01/02/2021,01-02-2021,2021,Product 4,Clothing,Florida,East,  East ,"Atlanta, Florida",USA,18.0,45.0,56.1,Yes,alex,0.20
1055,01/02/2021,01-02-2021,2021,Product 4,Clothing,North Carolina,East,  East ,"Miami, North Carolina",USA,35.0,87.5,113.29,No,Brooke,0.25
1056,01/02/2021,2021/02/01,2021,Product 4,Clothing,California,West,  West ,"New York City, California",USA,25.0,62.5,88.81,Unknown,CHRIS,0.30
1056,01/02/2021,01-02-2021,2021,Product 4,Clothing,Washington,West,  West ,"Philadelphia, Washington",USA,,80.0,118.24,Yes,Drew,0.15
1057,01/02/2021,01-02-2021,2021,Product 5,Clothing,New York,North,  North ,"Houston, New York",USA,25.0,37.5,44.13,No,Elliot,0.20
1057,01/02/2021,01-02-2021,2021,Product 5,Clothing,Pennsylvania,North,  North ,"Atlanta, Pennsylvania",USA,32.0,48.0,70.88,Unknown,,0.25
1058,01/02/2021,01-02-2021,2021,Product 5,Clothing,Texas,South,  South ,"Miami, Texas",USA,27.0,40.5,53.64,Yes,alex,0.30
1058,01/02/2021,01-02-2021,2021,Product 5,Clothing,Georgia,South,  South ,"New York City, Georgia",USA,23.0,34.5,46.83,No,Brooke,0.15
1059,01/02/2021,01-02-2021,2021,Product 5,Clothing,Florida,East,  East ,"Philadelphia, Florida",USA,21.0,31.5,38.46,Unknown,CHRIS,0.20
1059,01/02/2021,01-02-2021,2021,Product 5,Clothing,North Carolina,East,  East ,"Houston, North Carolina",USA,19.0,28.5,35.3,Yes,Drew,0.25
1060,01/02/2021,01-02-2021,2021,Product 5,Clothing,California,West,  West ,"Atlanta, California",USA,27.0,40.5,48.42,No,Elliot,0.30
1060,01/02/2021,01-02-2021,2021,Product 5,Clothing,Washington,West,  West ,"Miami, Washington",USA,23.0,34.5,41.52,Unknown,,0.15
1061,01/02/2021,2021/02/01,2021,Product 6,Clothing,New York,North,  North ,"New York City, New York",USA,16.0,64.0,77.15,Yes,alex,0.20
1061,01/02/2021,01-02-2021,2021,Product 6,Clothing,Pennsylvania,North,  North ,"Philadelphia, Pennsylvania",USA,18.0,72.0,95.51,No,Brooke,0.25
1062,01/02/2021,01-02-2021,2021,Product 6,Clothing,Texas,South,  South ,"Houston, Texas",USA,19.0,76.0,85.51,Unknown,CHRIS,0.30
1062,01/02/2021,01-02-2021,2021,Product 6,Clothing,Georgia,South,  South ,"Atlanta, Georgia",USA,20.0,80.0,104.02,Yes,Drew,0.15
1063,01/02/2021,01-02-2021,2021,Product 6,Clothing,Florida,East,  East ,"Miami, Florida",USA,26.0,104.0,133.41,No,Elliot,0.20
1063,01/02/2021,01-02-2021,2021,Product 6,Clothing,North Carolina,East,  East ,"New York City, North Carolina",USA,25.0,100.0,117.3,Unknown,,0.25
1064,01/02/2021,01-02-2021,2021,Product 6,Clothing,California,West,  West ,"Philadelphia, California",USA,25.0,100.0,117.53,Yes,alex,0.30
1064,01/02/2021,01-02-2021,2021,Product 6,Clothing,Washington,West,  West ,"Houston, Washington",USA,17.0,68.0,76.24,No,Brooke,0.15
1065,01/02/2021,01-02-2021,2021,Product 7,Home Goods,New York,North,  North ,"Atlanta, New York",USA,29.0,290.0,431.37,Unknown,CHRIS,0.20
1065,01/02/2021,01-02-2021,2021,Product 7,Home Goods,Pennsylvania,North,  North ,"Miami, Pennsylvania",USA,30.0,300.0,440.06,Yes,Drew,0.25
1066,01/02/2021,2021/02/01,2021,Product 7,Home Goods,Texas,South,  South ,"New York City, Texas",USA,25.0,250.0,330.28,No,Elliot,0.30
1066,01/02/2021,01-02-2021,2021,Product 7,Home Goods,Georgia,South,  South ,"Philadelphia, Georgia",USA,28.0,280.0,410.04,Unknown,,0.15
1067,01/02/2021,01-02-2021,2021,Product 7,Home Goods,Florida,East,  East ,"Houston, Florida",USA,25.0,250.0,343.6,Yes,alex,0.20
1067,01/02/2021,01-02-2021,2021,Product 7,Home Goods,North Carolina,East,  East ,"Atlanta, North Carolina",USA,25.0,250.0,280.38,No,Brooke,0.25
1068,01/02/2021,01-02-2021,2021,Product 7,Home Goods,California,West,  West ,"Miami, California",USA,31.0,310.0,389.93,Unknown,CHRIS,0.30
1068,01/02/2021,01-02-2021,2021,Product 7,Home Goods,Washington,West,  West ,"New York City, Washington",USA,35.0,350.0,427.11,Yes,Drew,0.15
1069,01/02/2021,01-02-2021,2021,Product 8,Home Goods,New York,North,  North ,"Philadelphia, New York",USA,23.0,172.5,203.9,No,Elliot,0.20
1069,01/02/2021,01-02-2021,2021,Product 8,Home Goods,Pennsylvania,North,  North ,"Houston, Pennsylvania",USA,31.0,232.5,342.81,Unknown,,0.25
1070,01/02/2021,01-02-2021,2021,Product 8,Home Goods,Texas,South,  South ,"Atlanta, Texas",USA,26.0,195.0,231.74,Yes,alex,0.30
1070,01/02/2021,01-02-2021,2021,Product 8,Home Goods,Georgia,South,  South ,"Miami, Georgia",USA,28.0,210.0,238.66,No,Brooke,0.15
1071,01/02/2021,2021/02/01,2021,Product 8,Home Goods,Florida,East,  East ,"New York City, Florida",USA,35.0,262.5,289.67,Unknown,CHRIS,0.20
1071,01/02/2021,01-02-2021,2021,Product 8,Home Goods,North Carolina,East,  East ,"Philadelphia, North Carolina",USA,17.0,127.5,156.25,Yes,Drew,0.25
1072,01/02/2021,01-02-2021,2021,Product 8,Home Goods,California,West,  West ,"Houston, California",USA,19.0,142.5,210.38,No,Elliot,0.30
1072,01/02/2021,01-02-2021,2021,Product 8,Home Goods,Washington,West,  West ,"Atlanta, Washington",USA,25.0,187.5,213.94,Unknown,,0.15
1073,01/02/2021,01-02-2021,2021,Product 9,Home Goods,New York,North,  North ,"Miami, New York",USA,22.0,110.0,127.16,Yes,alex,0.20
1073,01/02/2021,01-02-2021,2021,Product 9,Home Goods,Pennsylvania,North,  North ,"New York City, Pennsylvania",USA,22.0,110.0,154.28,No,Brooke,0.25
1074,01/02/2021,01-02-2021,2021,Product 9,Home Goods,Texas,South,  South ,"Philadelphia, Texas",USA,31.0,155.0,202.29,Unknown,CHRIS,0.30
1074,01/02/2021,01-02-2021,2021,Product 9,Home Goods,Georgia,South,  South ,"Houston, Georgia",USA,34.0,170.0,218.89,Yes,Drew,0.15
1075,01/02/2021,01-02-2021,2021,Product 9,Home Goods,Florida,East,  East ,"Atlanta, Florida",USA,,135.0,152.39,No,Elliot,0.20
1075,01/02/2021,01-02-2021,2021,Product 9,Home Goods,North Carolina,East,  East ,"Miami, North Carolina",USA,28.0,140.0,171.7,Unknown,,0.25
1076,01/02/2021,2021/02/01,2021,Product 9,Home Goods,California,West,  West ,"New York City, California",USA,21.0,105.0,141.66,Yes,alex,0.30
1076,01/02/2021,01-02-2021,2021,Product 9,Home Goods,Washington,West,  West ,"Philadelphia, Washington",USA,32.0,160.0,239.12,No,Brooke,0.15
1077,01/02/2021,01-02-2021,2021,Product 10,Home Goods,New York,North,  North ,"Houston, New York",USA,16.0,200.0,221.58,Unknown,CHRIS,0.20
1077,01/02/2021,01-02-2021,2021,Product 10,Home Goods,Pennsylvania,North,  North ,"Atlanta, Pennsylvania",USA,22.0,275.0,324.46,Yes,Drew,0.25
1078,01/02/2021,01-02-2021,2021,Product 10,Home Goods,Texas,South,  South ,"Miami, Texas",USA,34.0,425.0,607.21,No,Elliot,0.30
1078,01/02/2021,01-02-2021,2021,Product 10,Home Goods,Georgia,South,  South ,"New York City, Georgia",USA,17.0,212.5,298.0,Unknown,,0.15
1079,01/02/2021,01-02-2021,2021,Product 10,Home Goods,Florida,East,  East ,"Philadelphia, Florida",USA,17.0,212.5,277.9,Yes,alex,0.20
1079,01/02/2021,01-02-2021,2021,Product 10,Home Goods,North Carolina,East,  East ,"Houston, North Carolina",USA,20.0,250.0,348.45,No,Brooke,0.25
1080,01/02/2021,01-02-2021,2021,Product 10,Home Goods,California,West,  West ,"Atlanta, California",USA,25.0,312.5,447.27,Unknown,CHRIS,0.30
1080,01/02/2021,01-02-2021,2021,Product 10,Home Goods,Washington,West,  West ,"Miami, Washington",USA,32.0,,505.42,Yes,Drew,0.15
1081,01/03/2021,2021/03/01,2021,Product 1,Electronics,New York,North,  North ,"New York City, New York",USA,30.0,750.0,1031.63,No,Elliot,0.20
1081,01/03/2021,01-03-2021,2021,Product 1,Electronics,Pennsylvania,North,  North ,"Philadelphia, Pennsylvania",USA,16.0,400.0,569.85,Unknown,,0.25
1082,01/03/2021,01-03-2021,2021,Product 1,Electronics,Texas,South,  South ,"Houston, Texas",USA,23.0,575.0,672.01,Yes,alex,0.30
1082,01/03/2021,01-03-2021,2021,Product 1,Electronics,Georgia,South,  South ,"Atlanta, Georgia",USA,31.0,775.0,1126.84,No,Brooke,0.15
1083,01/03/2021,01-03-2021,2021,Product 1,Electronics,Florida,East,  East ,"Miami, Florida",USA,23.0,575.0,818.73,Unknown,CHRIS,0.20
1083,01/03/2021,01-03-2021,2021,Product 1,Electronics,North Carolina,East,  East ,"New York City, North Carolina",USA,26.0,650.0,772.44,Yes,Drew,0.25
1084,01/03/2021,01-03-2021,2021,Product 1,Electronics,California,West,  West ,"Philadelphia, California",USA,31.0,775.0,905.25,No,Elliot,0.30
1084,01/03/2021,01-03-2021,2021,Product 1,Electronics,Washington,West,  West ,"Houston, Washington",USA,22.0,550.0,806.23,Unknown,,0.15
1085,01/03/2021,01-03-2021,2021,Product 2,Electronics,New York,North,  North ,"Atlanta, New York",USA,18.0,270.0,383.13,Yes,alex,0.20
1085,01/03/2021,01-03-2021,2021,Product 2,Electronics,Pennsylvania,North,  North ,"Miami, Pennsylvania",USA,35.0,525.0,780.53,No,Brooke,0.25
1086,01/03/2021,2021/03/01,2021,Product 2,Electronics,Texas,South,  South ,"New York City, Texas",USA,23.0,345.0,437.15,Unknown,CHRIS,0.30
1086,01/03/2021,01-03-2021,2021,Product 2,Electronics,Georgia,South,  South ,"Philadelphia, Georgia",USA,23.0,345.0,420.92,Yes,Drew,0.15
1087,01/03/2021,01-03-2021,2021,Product 2,Electronics,Florida,East,  East ,"Houston, Florida",USA,24.0,360.0,486.71,No,Elliot,0.20
1087,01/03/2021,01-03-2021,2021,Product 2,Electronics,North Carolina,East,  East ,"Atlanta, North Carolina",USA,27.0,405.0,528.48,Unknown,,0.25
1088,01/03/2021,01-03-2021,2021,Product 2,Electronics,California,West,  West ,"Miami, California",USA,25.0,375.0,547.32,Yes,alex,0.30
1088,01/03/2021,01-03-2021,2021,Product 2,Electronics,Washington,West,  West ,"New York City, Washington",USA,34.0,510.0,636.98,No,Brooke,0.15
1089,01/03/2021,01-03-2021,2021,Product 3,Electronics,New York,North,  North ,"Philadelphia, New York",USA,28.0,1400.0,1872.53,Unknown,CHRIS,0.20
1089,01/03/2021,01-03-2021,2021,Product 3,Electronics,Pennsylvania,North,  North ,"Houston, Pennsylvania",USA,26.0,1300.0,1944.47,Yes,Drew,0.25
1090,01/03/2021,01-03-2021,2021,Product 3,Electronics,Texas,South,  South ,"Atlanta, Texas",USA,22.0,1100.0,1514.54,No,Elliot,0.30
1090,01/03/2021,01-03-2021,2021,Product 3,Electronics,Georgia,South,  South ,"Miami, Georgia",USA,31.0,1550.0,2095.04,Unknown,,0.15
1091,01/03/2021,2021/03/01,2021,Product 3,Electronics,Florida,East,  East ,"New York City, Florida",USA,31.0,1550.0,1827.14,Yes,alex,0.20
1091,01/03/2021,01-03-2021,2021,Product 3,Electronics,North Carolina,East,  East ,"Philadelphia, North Carolina",USA,16.0,800.0,1069.97,No,Brooke,0.25
1092,01/03/2021,01-03-2021,2021,Product 3,Electronics,California,West,  West ,"Houston, California",USA,30.0,1500.0,2189.01,Unknown,CHRIS,0.30
1092,01/03/2021,01-03-2021,2021,Product 3,Electronics,Washington,West,  West ,"Atlanta, Washington",USA,20.0,1000.0,1207.08,Yes,Drew,0.15
1093,01/03/2021,01-03-2021,2021,Product 4,Clothing,New York,North,  North ,"Miami, New York",USA,16.0,40.0,58.65,No,Elliot,0.20
1093,01/03/2021,01-03-2021,2021,Product 4,Clothing,Pennsylvania,North,  North ,"New York City, Pennsylvania",USA,,72.5,92.04,Unknown,,0.25
1094,01/03/2021,01-03-2021,2021,Product 4,Clothing,Texas,South,  South ,"Philadelphia, Texas",USA,16.0,40.0,44.86,Yes,alex,0.30
1094,01/03/2021,01-03-2021,2021,Product 4,Clothing,Georgia,South,  South ,"Houston, Georgia",USA,16.0,40.0,44.15,No,Brooke,0.15
1095,01/03/2021,01-03-2021,2021,Product 4,Clothing,Florida,East,  East ,"Atlanta, Florida",USA,34.0,85.0,113.74,Unknown,CHRIS,0.20
1095,01/03/2021,01-03-2021,2021,Product 4,Clothing,North Carolina,East,  East ,"Miami, North Carolina",USA,18.0,45.0,57.92,Yes,Drew,0.25
1096,01/03/2021,2021/03/01,2021,Product 4,Clothing,California,West,  West ,"New York City, California",USA,32.0,80.0,104.12,No,Elliot,0.30
1096,01/03/2021,01-03-2021,2021,Product 4,Clothing,Washington,West,  West ,"Philadelphia, Washington",USA,23.0,57.5,83.25,Unknown,,0.15
1097,01/03/2021,01-03-2021,2021,Product 5,Clothing,New York,North,  North ,"Houston, New York",USA,22.0,33.0,45.92,Yes,alex,0.20
1097,01/03/2021,01-03-2021,2021,Product 5,Clothing,Pennsylvania,North,  North ,"Atlanta, Pennsylvania",USA,17.0,25.5,29.44,No,Brooke,0.25
1098,01/03/2021,01-03-2021,2021,Product 5,Clothing,Texas,South,  South ,"Miami, Texas",USA,24.0,36.0,42.88,Unknown,CHRIS,0.30
1098,01/03/2021,01-03-2021,2021,Product 5,Clothing,Georgia,South,  South ,"New York City, Georgia",USA,34.0,51.0,75.39,Yes,Drew,0.15
1099,01/03/2021,01-03-2021,2021,Product 5,Clothing,Florida,East,  East ,"Philadelphia, Florida",USA,16.0,24.0,34.39,No,Elliot,0.20
1099,01/03/2021,01-03-2021,2021,Product 5,Clothing,North Carolina,East,  East ,"Houston, North Carolina",USA,30.0,45.0,57.9,Unknown,,0.25
1100,01/03/2021,01-03-2021,2021,Product 5,Clothing,California,West,  West ,"Atlanta, California",USA,34.0,51.0,67.59,Yes,alex,0.30
1100,01/03/2021,01-03-2021,2021,Product 5,Clothing,Washington,West,  West ,"Miami, Washington",USA,18.0,27.0,30.25,No,Brooke,0.15
1101,01/03/2021,2021/03/01,2021,Product 6,Clothing,New York,North,  North ,"New York City, New York",USA,17.0,68.0,79.88,Unknown,CHRIS,0.20
1101,01/03/2021,01-03-2021,2021,Product 6,Clothing,Pennsylvania,North,  North ,"Philadelphia, Pennsylvania",USA,22.0,88.0,106.36,Yes,Drew,0.25
1102,01/03/2021,01-03-2021,2021,Product 6,Clothing,Texas,South,  South ,"Houston, Texas",USA,31.0,124.0,ERROR,No,Elliot,0.30
1102,01/03/2021,01-03-2021,2021,Product 6,Clothing,Georgia,South,  South ,"Atlanta, Georgia",USA,32.0,128.0,151.43,Unknown,,0.15
1103,01/03/2021,01-03-2021,2021,Product 6,Clothing,Florida,East,  East ,"Miami, Florida",USA,35.0,140.0,209.94,Yes,alex,0.20
1103,01/03/2021,01-03-2021,2021,Product 6,Clothing,North Carolina,East,  East ,"New York City, North Carolina",USA,28.0,112.0,129.27,No,Brooke,0.25
1104,01/03/2021,01-03-2021,2021,Product 6,Clothing,California,West,  West ,"Philadelphia, California",USA,21.0,84.0,119.24,Unknown,CHRIS,0.30
1104,01/03/2021,01-03-2021,2021,Product 6,Clothing,Washington,West,  West ,"Houston, Washington",USA,22.0,88.0,128.92,Yes,Drew,0.15
1105,01/03/2021,01-03-2021,2021,Product 7,Home Goods,New York,North,  North ,"Atlanta, New York",USA,27.0,270.0,344.09,No,Elliot,0.20
1105,01/03/2021,01-03-2021,2021,Product 7,Home Goods,Pennsylvania,North,  North ,"Miami, Pennsylvania",USA,23.0,230.0,280.19,Unknown,,0.25
1106,01/03/2021,2021/03/01,2021,Product 7,Home Goods,Texas,South,  South ,"New York City, Texas",USA,32.0,320.0,477.98,Yes,alex,0.30
1106,01/03/2021,01-03-2021,2021,Product 7,Home Goods,Georgia,South,  South ,"Philadelphia, Georgia",USA,26.0,260.0,383.82,No,Brooke,0.15
1107,01/03/2021,01-03-2021,2021,Product 7,Home Goods,Florida,East,  East ,"Houston, Florida",USA,16.0,,205.33,Unknown,CHRIS,0.20
1107,01/03/2021,01-03-2021,2021,Product 7,Home Goods,North Carolina,East,  East ,"Atlanta, North Carolina",USA,28.0,280.0,402.95,Yes,Drew,0.25
1108,01/03/2021,01-03-2021,2021,Product 7,Home Goods,California,West,  West ,"Miami, California",USA,27.0,270.0,395.17,No,Elliot,0.30
1108,01/03/2021,01-03-2021,2021,Product 7,Home Goods,Washington,West,  West ,"New York City, Washington",USA,25.0,250.0,358.99,Unknown,,0.15
1109,01/03/2021,01-03-2021,2021,Product 8,Home Goods,New York,North,  North ,"Philadelphia, New York",USA,18.0,135.0,154.13,Yes,alex,0.20
1109,01/03/2021,01-03-2021,2021,Product 8,Home Goods,Pennsylvania,North,  North ,"Houston, Pennsylvania",USA,27.0,202.5,236.16,No,Brooke,0.25
1110,01/03/2021,01-03-2021,2021,Product 8,Home Goods,Texas,South,  South ,"Atlanta, Texas",USA,30.0,225.0,276.19,Unknown,CHRIS,0.30
1110,01/03/2021,01-03-2021,2021,Product 8,Home Goods,Georgia,South,  South ,"Miami, Georgia",USA,24.0,180.0,240.79,Yes,Drew,0.15
1111,01/03/2021,2021/03/01,2021,Product 8,Home Goods,Florida,East,  East ,"New York City, Florida",USA,30.0,225.0,249.14,No,Elliot,0.20
1111,01/03/2021,01-03-2021,2021,Product 8,Home Goods,North Carolina,East,  East ,"Philadelphia, North Carolina",USA,20.0,150.0,173.59,Unknown,,0.25
1112,01/03/2021,01-03-2021,2021,Product 8,Home Goods,California,West,  West ,"Houston, California",USA,,165.0,210.32,Yes,alex,0.30
1112,01/03/2021,01-03-2021,2021,Product 8,Home Goods,Washington,West,  West ,"Atlanta, Washington",USA,28.0,210.0,270.34,No,Brooke,0.15
1113,01/03/2021,01-03-2021,2021,Product 9,Home Goods,New York,North,  North ,"Miami, New York",USA,17.0,85.0,111.26,Unknown,CHRIS,0.20
1113,01/03/2021,01-03-2021,2021,Product 9,Home Goods,Pennsylvania,North,  North ,"New York City, Pennsylvania",USA,25.0,125.0,176.36,Yes,Drew,0.25
1114,01/03/2021,01-03-2021,2021,Product 9,Home Goods,Texas,South,  South ,"Philadelphia, Texas",USA,34.0,170.0,193.39,No,Elliot,0.30
1114,01/03/2021,01-03-2021,2021,Product 9,Home Goods,Georgia,South,  South ,"Houston, Georgia",USA,33.0,165.0,225.83,Unknown,,0.15
1115,01/03/2021,01-03-2021,2021,Product 9,Home Goods,Florida,East,  East ,"Atlanta, Florida",USA,35.0,175.0,233.55,Yes,alex,0.20
1115,01/03/2021,01-03-2021,2021,Product 9,Home Goods,North Carolina,East,  East ,"Miami, North Carolina",USA,22.0,110.0,156.62,No,Brooke,0.25
1116,01/03/2021,2021/03/01,2021,Product 9,Home Goods,California,West,  West ,"New York City, California",USA,34.0,170.0,239.97,Unknown,CHRIS,0.30
1116,01/03/2021,01-03-2021,2021,Product 9,Home Goods,Washington,West,  West ,"Philadelphia, Washington",USA,20.0,100.0,149.34,Yes,Drew,0.15
1117,01/03/2021,01-03-2021,2021,Product 10,Home Goods,New York,North,  North ,"Houston, New York",USA,32.0,400.0,517.42,No,Elliot,0.20
1117,01/03/2021,01-03-2021,2021,Product 10,Home Goods,Pennsylvania,North,  North ,"Atlanta, Pennsylvania",USA,28.0,350.0,461.01,Unknown,,0.25
1118,01/03/2021,01-03-2021,2021,Product 10,Home Goods,Texas,South,  South ,"Miami, Texas",USA,30.0,375.0,556.34,Yes,alex,0.30
1118,01/03/2021,01-03-2021,2021,Product 10,Home Goods,Georgia,South,  South ,"New York City, Georgia",USA,34.0,425.0,562.54,No,Brooke,0.15
1119,01/03/2021,01-03-2021,2021,Product 10,Home Goods,Florida,East,  East ,"Philadelphia, Florida",USA,30.0,375.0,449.99,Unknown,CHRIS,0.20
1119,01/03/2021,01-03-2021,2021,Product 10,Home Goods,North Carolina,East,  East ,"Houston, North Carolina",USA,24.0,300.0,398.24,Yes,Drew,0.25
1120,01/03/2021,01-03-2021,2021,Product 10,Home Goods,California,West,  West ,"Atlanta, California",USA,35.0,437.5,583.13,No,Elliot,0.30
1120,01/03/2021,01-03-2021,2021,Product 10,Home Goods,Washington,West,  West ,"Miami, Washington",USA,17.0,212.5,296.31,Unknown,,0.15
1121,01/04/2021,2021/04/01,2021,Product 1,Electronics,New York,North,  North ,"New York City, New York",USA,36.0,900.0,1244.74,Yes,alex,0.20
1121,01/04/2021,01-04-2021,2021,Product 1,Electronics,Pennsylvania,North,  North ,"Philadelphia, Pennsylvania",USA,27.0,675.0,975.82,No,Brooke,0.25
1122,01/04/2021,01-04-2021,2021,Product 1,Electronics,Texas,South,  South ,"Houston, Texas",USA,21.0,525.0,726.8,Unknown,CHRIS,0.30
1122,01/04/2021,01-04-2021,2021,Product 1,Electronics,Georgia,South,  South ,"Atlanta, Georgia",USA,28.0,700.0,810.88,Yes,Drew,0.15
1123,01/04/2021,01-04-2021,2021,Product 1,Electronics,Florida,East,  East ,"Miami, Florida",USA,36.0,900.0,1105.92,No,Elliot,0.20
1123,01/04/2021,01-04-2021,2021,Product 1,Electronics,North Carolina,East,  East ,"New York City, North Carolina",USA,28.0,700.0,972.67,Unknown,,0.25
1124,01/04/2021,01-04-2021,2021,Product 1,Electronics,California,West,  West ,"Philadelphia, California",USA,32.0,800.0,946.82,Yes,alex,0.30
1124,01/04/2021,01-04-2021,2021,Product 1,Electronics,Washington,West,  West ,"Houston, Washington",USA,34.0,850.0,1000.64,No,Brooke,0.15
1125,01/04/2021,01-04-2021,2021,Product 2,Electronics,New York,North,  North ,"Atlanta, New York",USA,21.0,315.0,420.54,Unknown,CHRIS,0.20
1125,01/04/2021,01-04-2021,2021,Product 2,Electronics,Pennsylvania,North,  North ,"Miami, Pennsylvania",USA,34.0,510.0,616.39,Yes,Drew,0.25
1126,01/04/2021,2021/04/01,2021,Product 2,Electronics,Texas,South,  South ,"New York City, Texas",USA,28.0,420.0,490.54,No,Elliot,0.30
1126,01/04/2021,01-04-2021,2021,Product 2,Electronics,Georgia,South,  South ,"Philadelphia, Georgia",USA,29.0,435.0,635.62,Unknown,,0.15
1127,01/04/2021,01-04-2021,2021,Product 2,Electronics,Florida,East,  East ,"Houston, Florida",USA,31.0,465.0,613.16,Yes,alex,0.20
1127,01/04/2021,01-04-2021,2021,Product 2,Electronics,North Carolina,East,  East ,"Atlanta, North Carolina",USA,33.0,495.0,593.94,No,Brooke,0.25
1128,01/04/2021,01-04-2021,2021,Product 2,Electronics,California,West,  West ,"Miami, California",USA,18.0,270.0,338.32,Unknown,CHRIS,0.30
1128,01/04/2021,01-04-2021,2021,Product 2,Electronics,Washington,West,  West ,"New York City, Washington",USA,23.0,345.0,445.49,Yes,Drew,0.15
1129,01/04/2021,01-04-2021,2021,Product 3,Electronics,New York,North,  North ,"Philadelphia, New York",USA,21.0,1050.0,1411.95,No,Elliot,0.20
1129,01/04/2021,01-04-2021,2021,Product 3,Electronics,Pennsylvania,North,  North ,"Houston, Pennsylvania",USA,30.0,1500.0,1980.05,Unknown,,0.25
1130,01/04/2021,01-04-2021,2021,Product 3,Electronics,Texas,South,  South ,"Atlanta, Texas",USA,23.0,1150.0,1588.21,Yes,alex,0.30
1130,01/04/2021,01-04-2021,2021,Product 3,Electronics,Georgia,South,  South ,"Miami, Georgia",USA,,1250.0,1586.29,No,Brooke,0.15
1131,01/04/2021,2021/04/01,2021,Product 3,Electronics,Florida,East,  East ,"New York City, Florida",USA,32.0,1600.0,2064.36,Unknown,CHRIS,0.20
1131,01/04/2021,01-04-2021,2021,Product 3,Electronics,North Carolina,East,  East ,"Philadelphia, North Carolina",USA,35.0,1750.0,2123.7,Yes,Drew,0.25
1132,01/04/2021,01-04-2021,2021,Product 3,Electronics,California,West,  West ,"Houston, California",USA,18.0,900.0,1178.31,No,Elliot,0.30
1132,01/04/2021,01-04-2021,2021,Product 3,Electronics,Washington,West,  West ,"Atlanta, Washington",USA,28.0,1400.0,1946.64,Unknown,,0.15
1133,01/04/2021,01-04-2021,2021,Product 4,Clothing,New York,North,  North ,"Miami, New York",USA,29.0,72.5,100.94,Yes,alex,0.20
1133,01/04/2021,01-04-2021,2021,Product 4,Clothing,Pennsylvania,North,  North ,"New York City, Pennsylvania",USA,35.0,,127.15,No,Brooke,0.25
1134,01/04/2021,01-04-2021,2021,Product 4,Clothing,Texas,South,  South ,"Philadelphia, Texas",USA,36.0,90.0,116.86,Unknown,CHRIS,0.30
1134,01/04/2021,01-04-2021,2021,Product 4,Clothing,Georgia,South,  South ,"Houston, Georgia",USA,23.0,57.5,77.28,Yes,Drew,0.15
1135,01/04/2021,01-04-2021,2021,Product 4,Clothing,Florida,East,  East ,"Atlanta, Florida",USA,23.0,57.5,64.05,No,Elliot,0.20
1135,01/04/2021,01-04-2021,2021,Product 4,Clothing,North Carolina,East,  East ,"Miami, North Carolina",USA,33.0,82.5,98.21,Unknown,,0.25
1136,01/04/2021,2021/04/01,2021,Product 4,Clothing,California,West,  West ,"New York City, California",USA,17.0,42.5,61.69,Yes,alex,0.30
1136,01/04/2021,01-04-2021,2021,Product 4,Clothing,Washington,West,  West ,"Philadelphia, Washington",USA,34.0,85.0,93.81,No,Brooke,0.15
1137,01/04/2021,01-04-2021,2021,Product 5,Clothing,New York,North,  North ,"Houston, New York",USA,32.0,48.0,55.95,Unknown,CHRIS,0.20
1137,01/04/2021,01-04-2021,2021,Product 5,Clothing,Pennsylvania,North,  North ,"Atlanta, Pennsylvania",USA,30.0,45.0,50.36,Yes,Drew,0.25
1138,01/04/2021,01-04-2021,2021,Product 5,Clothing,Texas,South,  South ,"Miami, Texas",USA,32.0,48.0,53.13,No,Elliot,0.30
1138,01/04/2021,01-04-2021,2021,Product 5,Clothing,Georgia,South,  South ,"New York City, Georgia",USA,27.0,40.5,46.11,Unknown,,0.15
1139,01/04/2021,01-04-2021,2021,Product 5,Clothing,Florida,East,  East ,"Philadelphia, Florida",USA,31.0,46.5,69.15,Yes,alex,0.20
1139,01/04/2021,01-04-2021,2021,Product 5,Clothing,North Carolina,East,  East ,"Houston, North Carolina",USA,24.0,36.0,40.57,No,Brooke,0.25
1140,01/04/2021,01-04-2021,2021,Product 5,Clothing,California,West,  West ,"Atlanta, California",USA,20.0,30.0,41.28,Unknown,CHRIS,0.30
1140,01/04/2021,01-04-2021,2021,Product 5,Clothing,Washington,West,  West ,"Miami, Washington",USA,28.0,42.0,55.36,Yes,Drew,0.15
1141,01/04/2021,2021/04/01,2021,Product 6,Clothing,New York,North,  North ,"New York City, New York",USA,17.0,68.0,83.46,No,Elliot,0.20
1141,01/04/2021,01-04-2021,2021,Product 6,Clothing,Pennsylvania,North,  North ,"Philadelphia, Pennsylvania",USA,34.0,136.0,168.69,Unknown,,0.25
1142,01/04/2021,01-04-2021,2021,Product 6,Clothing,Texas,South,  South ,"Houston, Texas",USA,19.0,76.0,104.07,Yes,alex,0.30
1142,01/04/2021,01-04-2021,2021,Product 6,Clothing,Georgia,South,  South ,"Atlanta, Georgia",USA,34.0,136.0,152.54,No,Brooke,0.15
1143,01/04/2021,01-04-2021,2021,Product 6,Clothing,Florida,East,  East ,"Miami, Florida",USA,32.0,128.0,150.79,Unknown,CHRIS,0.20
1143,01/04/2021,01-04-2021,2021,Product 6,Clothing,North Carolina,East,  East ,"New York City, North Carolina",USA,17.0,68.0,87.6,Yes,Drew,0.25
1144,01/04/2021,01-04-2021,2021,Product 6,Clothing,California,West,  West ,"Philadelphia, California",USA,34.0,136.0,184.55,No,Elliot,0.30
1144,01/04/2021,01-04-2021,2021,Product 6,Clothing,Washington,West,  West ,"Houston, Washington",USA,18.0,72.0,98.74,Unknown,,0.15
1145,01/04/2021,01-04-2021,2021,Product 7,Home Goods,New York,North,  North ,"Atlanta, New York",USA,26.0,260.0,312.03,Yes,alex,0.20
1145,01/04/2021,01-04-2021,2021,Product 7,Home Goods,Pennsylvania,North,  North ,"Miami, Pennsylvania",USA,23.0,230.0,282.42,No,Brooke,0.25
1146,01/04/2021,2021/04/01,2021,Product 7,Home Goods,Texas,South,  South ,"New York City, Texas",USA,31.0,310.0,359.36,Unknown,CHRIS,0.30
1146,01/04/2021,01-04-2021,2021,Product 7,Home Goods,Georgia,South,  South ,"Philadelphia, Georgia",USA,34.0,340.0,402.26,Yes,Drew,0.15
1147,01/04/2021,01-04-2021,2021,Product 7,Home Goods,Florida,East,  East ,"Houston, Florida",USA,31.0,310.0,443.89,No,Elliot,0.20
1147,01/04/2021,01-04-2021,2021,Product 7,Home Goods,North Carolina,East,  East ,"Atlanta, North Carolina",USA,35.0,350.0,505.89,Unknown,,0.25
1148,01/04/2021,01-04-2021,2021,Product 7,Home Goods,California,West,  West ,"Miami, California",USA,18.0,180.0,247.7,Yes,alex,0.30
1148,01/04/2021,01-04-2021,2021,Product 7,Home Goods,Washington,West,  West ,"New York City, Washington",USA,24.0,240.0,299.74,No,Brooke,0.15
1149,01/04/2021,01-04-2021,2021,Product 8,Home Goods,New York,North,  North ,"Philadelphia, New York",USA,,210.0,247.32,Unknown,CHRIS,0.20
1149,01/04/2021,01-04-2021,2021,Product 8,Home Goods,Pennsylvania,North,  North ,"Houston, Pennsylvania",USA,30.0,225.0,331.68,Yes,Drew,0.25
1150,01/04/2021,01-04-2021,2021,Product 8,Home Goods,Texas,South,  South ,"Atlanta, Texas",USA,19.0,142.5,160.76,No,Elliot,0.30
1150,01/04/2021,01-04-2021,2021,Product 8,Home Goods,Georgia,South,  South ,"Miami, Georgia",USA,20.0,150.0,193.51,Unknown,,0.15
1151,01/04/2021,2021/04/01,2021,Product 8,Home Goods,Florida,East,  East ,"New York City, Florida",USA,20.0,150.0,199.79,Yes,alex,0.20
1151,01/04/2021,01-04-2021,2021,Product 8,Home Goods,North Carolina,East,  East ,"Philadelphia, North Carolina",USA,19.0,142.5,172.68,No,Brooke,0.25
1152,01/04/2021,01-04-2021,2021,Product 8,Home Goods,California,West,  West ,"Houston, California",USA,22.0,165.0,243.78,Unknown,CHRIS,0.30
1152,01/04/2021,01-04-2021,2021,Product 8,Home Goods,Washington,West,  West ,"Atlanta, Washington",USA,35.0,262.5,ERROR,Yes,Drew,0.15
1153,01/04/2021,01-04-2021,2021,Product 9,Home Goods,New York,North,  North ,"Miami, New York",USA,36.0,180.0,265.66,No,Elliot,0.20
1153,01/04/2021,01-04-2021,2021,Product 9,Home Goods,Pennsylvania,North,  North ,"New York City, Pennsylvania",USA,26.0,130.0,145.55,Unknown,,0.25
1154,01/04/2021,01-04-2021,2021,Product 9,Home Goods,Texas,South,  South ,"Philadelphia, Texas",USA,19.0,95.0,107.05,Yes,alex,0.30
1154,01/04/2021,01-04-2021,2021,Product 9,Home Goods,Georgia,South,  South ,"Houston, Georgia",USA,21.0,105.0,140.28,No,Brooke,0.15
1155,01/04/2021,01-04-2021,2021,Product 9,Home Goods,Florida,East,  East ,"Atlanta, Florida",USA,27.0,135.0,199.5,Unknown,CHRIS,0.20
1155,01/04/2021,01-04-2021,2021,Product 9,Home Goods,North Carolina,East,  East ,"Miami, North Carolina",USA,29.0,145.0,199.78,Yes,Drew,0.25
1156,01/04/2021,2021/04/01,2021,Product 9,Home Goods,California,West,  West ,"New York City, California",USA,31.0,155.0,216.99,No,Elliot,0.30
1156,01/04/2021,01-04-2021,2021,Product 9,Home Goods,Washington,West,  West ,"Philadelphia, Washington",USA,33.0,165.0,185.12,Unknown,,0.15
1157,01/04/2021,01-04-2021,2021,Product 10,Home Goods,New York,North,  North ,"Houston, New York",USA,35.0,437.5,502.76,Yes,alex,0.20
1157,01/04/2021,01-04-2021,2021,Product 10,Home Goods,Pennsylvania,North,  North ,"Atlanta, Pennsylvania",USA,34.0,425.0,521.47,No,Brooke,0.25
1158,01/04/2021,01-04-2021,2021,Product 10,Home Goods,Texas,South,  South ,"Miami, Texas",USA,20.0,250.0,335.87,Unknown,CHRIS,0.30
1158,01/04/2021,01-04-2021,2021,Product 10,Home Goods,Georgia,South,  South ,"New York City, Georgia",USA,34.0,425.0,626.42,Yes,Drew,0.15
1159,01/04/2021,01-04-2021,2021,Product 10,Home Goods,Florida,East,  East ,"Philadelphia, Florida",USA,18.0,225.0,256.82,No,Elliot,0.20
1159,01/04/2021,01-04-2021,2021,Product 10,Home Goods,North Carolina,East,  East ,"Houston, North Carolina",USA,17.0,212.5,237.49,Unknown,,0.25
1160,01/04/2021,01-04-2021,2021,Product 10,Home Goods,California,West,  West ,"Atlanta, California",USA,34.0,,624.39,Yes,alex,0.30
1160,01/04/2021,01-04-2021,2021,Product 10,Home Goods,Washington,West,  West ,"Miami, Washington",USA,27.0,337.5,473.41,No,Brooke,0.15
1161,01/05/2021,2021/05/01,2021,Product 1,Electronics,New York,North,  North ,"New York City, New York",USA,22.0,550.0,770.54,Unknown,CHRIS,0.20
1161,01/05/2021,01-05-2021,2021,Product 1,Electronics,Pennsylvania,North,  North ,"Philadelphia, Pennsylvania",USA,21.0,525.0,746.29,Yes,Drew,0.25
1162,01/05/2021,01-05-2021,2021,Product 1,Electronics,Texas,South,  South ,"Houston, Texas",USA,20.0,500.0,606.85,No,Elliot,0.30
1162,01/05/2021,01-05-2021,2021,Product 1,Electronics,Georgia,South,  South ,"Atlanta, Georgia",USA,35.0,875.0,1247.49,Unknown,,0.15
1163,01/05/2021,01-05-2021,2021,Product 1,Electronics,Florida,East,  East ,"Miami, Florida",USA,33.0,825.0,1035.0,Yes,alex,0.20
1163,01/05/2021,01-05-2021,2021,Product 1,Electronics,North Carolina,East,  East ,"New York City, North Carolina",USA,27.0,675.0,964.11,No,Brooke,0.25
1164,01/05/2021,01-05-2021,2021,Product 1,Electronics,California,West,  West ,"Philadelphia, California",USA,19.0,475.0,596.81,Unknown,CHRIS,0.30
1164,01/05/2021,01-05-2021,2021,Product 1,Electronics,Washington,West,  West ,"Houston, Washington",USA,21.0,525.0,732.86,Yes,Drew,0.15
1165,01/05/2021,01-05-2021,2021,Product 2,Electronics,New York,North,  North ,"Atlanta, New York",USA,35.0,525.0,738.32,No,Elliot,0.20
1165,01/05/2021,01-05-2021,2021,Product 2,Electronics,Pennsylvania,North,  North ,"Miami, Pennsylvania",USA,34.0,510.0,714.47,Unknown,,0.25
1166,01/05/2021,2021/05/01,2021,Product 2,Electronics,Texas,South,  South ,"New York City, Texas",USA,29.0,435.0,585.8,Yes,alex,0.30
1166,01/05/2021,01-05-2021,2021,Product 2,Electronics,Georgia,South,  South ,"Philadelphia, Georgia",USA,31.0,465.0,614.27,No,Brooke,0.15
1167,01/05/2021,01-05-2021,2021,Product 2,Electronics,Florida,East,  East ,"Houston, Florida",USA,29.0,435.0,616.38,Unknown,CHRIS,0.20
1167,01/05/2021,01-05-2021,2021,Product 2,Electronics,North Carolina,East,  East ,"Atlanta, North Carolina",USA,,360.0,422.02,Yes,Drew,0.25
1168,01/05/2021,01-05-2021,2021,Product 2,Electronics,California,West,  West ,"Miami, California",USA,19.0,285.0,357.23,No,Elliot,0.30
1168,01/05/2021,01-05-2021,2021,Product 2,Electronics,Washington,West,  West ,"New York City, Washington",USA,25.0,375.0,463.88,Unknown,,0.15
1169,01/05/2021,01-05-2021,2021,Product 3,Electronics,New York,North,  North ,"Philadelphia, New York",USA,29.0,1450.0,1954.23,Yes,alex,0.20
1169,01/05/2021,01-05-2021,2021,Product 3,Electronics,Pennsylvania,North,  North ,"Houston, Pennsylvania",USA,26.0,1300.0,1914.01,No,Brooke,0.25
1170,01/05/2021,01-05-2021,2021,Product 3,Electronics,Texas,South,  South ,"Atlanta, Texas",USA,31.0,1550.0,1787.95,Unknown,CHRIS,0.30
1170,01/05/2021,01-05-2021,2021,Product 3,Electronics,Georgia,South,  South ,"Miami, Georgia",USA,25.0,1250.0,1764.01,Yes,Drew,0.15
1171,01/05/2021,2021/05/01,2021,Product 3,Electronics,Florida,East,  East ,"New York City, Florida",USA,24.0,1200.0,1757.25,No,Elliot,0.20
1171,01/05/2021,01-05-2021,2021,Product 3,Electronics,North Carolina,East,  East ,"Philadelphia, North Carolina",USA,26.0,1300.0,1938.17,Unknown,,0.25
1172,01/05/2021,01-05-2021,2021,Product 3,Electronics,California,West,  West ,"Houston, California",USA,31.0,1550.0,1811.75,Yes,alex,0.30
1172,01/05/2021,01-05-2021,2021,Product 3,Electronics,Washington,West,  West ,"Atlanta, Washington",USA,35.0,1750.0,2258.63,No,Brooke,0.15
1173,01/05/2021,01-05-2021,2021,Product 4,Clothing,New York,North,  North ,"Miami, New York",USA,35.0,87.5,98.58,Unknown,CHRIS,0.20
1173,01/05/2021,01-05-2021,2021,Product 4,Clothing,Pennsylvania,North,  North ,"New York City, Pennsylvania",USA,34.0,85.0,119.15,Yes,Drew,0.25
1174,01/05/2021,01-05-2021,2021,Product 4,Clothing,Texas,South,  South ,"Philadelphia, Texas",USA,17.0,42.5,50.53,No,Elliot,0.30
1174,01/05/2021,01-05-2021,2021,Product 4,Clothing,Georgia,South,  South ,"Houston, Georgia",USA,22.0,55.0,70.91,Unknown,,0.15
1175,01/05/2021,01-05-2021,2021,Product 4,Clothing,Florida,East,  East ,"Atlanta, Florida",USA,19.0,47.5,55.82,Yes,alex,0.20
1175,01/05/2021,01-05-2021,2021,Product 4,Clothing,North Carolina,East,  East ,"Miami, North Carolina",USA,33.0,82.5,94.96,No,Brooke,0.25
1176,01/05/2021,2021/05/01,2021,Product 4,Clothing,California,West,  West ,"New York City, California",USA,34.0,85.0,120.26,Unknown,CHRIS,0.30
1176,01/05/2021,01-05-2021,2021,Product 4,Clothing,Washington,West,  West ,"Philadelphia, Washington",USA,30.0,75.0,84.77,Yes,Drew,0.15
1177,01/05/2021,01-05-2021,2021,Product 5,Clothing,New York,North,  North ,"Houston, New York",USA,26.0,39.0,52.24,No,Elliot,0.20
1177,01/05/2021,01-05-2021,2021,Product 5,Clothing,Pennsylvania,North,  North ,"Atlanta, Pennsylvania",USA,37.0,55.5,75.23,Unknown,,0.25
1178,01/05/2021,01-05-2021,2021,Product 5,Clothing,Texas,South,  South ,"Miami, Texas",USA,28.0,42.0,50.81,Yes,alex,0.30
1178,01/05/2021,01-05-2021,2021,Product 5,Clothing,Georgia,South,  South ,"New York City, Georgia",USA,34.0,51.0,71.98,No,Brooke,0.15
1179,01/05/2021,01-05-2021,2021,Product 5,Clothing,Florida,East,  East ,"Philadelphia, Florida",USA,32.0,48.0,55.99,Unknown,CHRIS,0.20
1179,01/05/2021,01-05-2021,2021,Product 5,Clothing,North Carolina,East,  East ,"Houston, North Carolina",USA,35.0,52.5,74.78,Yes,Drew,0.25
1180,01/05/2021,01-05-2021,2021,Product 5,Clothing,California,West,  West ,"Atlanta, California",USA,29.0,43.5,61.62,No,Elliot,0.30
1180,01/05/2021,01-05-2021,2021,Product 5,Clothing,Washington,West,  West ,"Miami, Washington",USA,33.0,49.5,59.0,Unknown,,0.15
1181,01/05/2021,2021/05/01,2021,Product 6,Clothing,New York,North,  North ,"New York City, New York",USA,32.0,128.0,158.16,Yes,alex,0.20
1181,01/05/2021,01-05-2021,2021,Product 6,Clothing,Pennsylvania,North,  North ,"Philadelphia, Pennsylvania",USA,28.0,112.0,158.29,No,Brooke,0.25
1182,01/05/2021,01-05-2021,2021,Product 6,Clothing,Texas,South,  South ,"Houston, Texas",USA,20.0,80.0,95.38,Unknown,CHRIS,0.30
1182,01/05/2021,01-05-2021,2021,Product 6,Clothing,Georgia,South,  South ,"Atlanta, Georgia",USA,36.0,144.0,159.27,Yes,Drew,0.15
1183,01/05/2021,01-05-2021,2021,Product 6,Clothing,Florida,East,  East ,"Miami, Florida",USA,21.0,84.0,100.99,No,Elliot,0.20
1183,01/05/2021,01-05-2021,2021,Product 6,Clothing,North Carolina,East,  East ,"New York City, North Carolina",USA,33.0,132.0,194.5,Unknown,,0.25
1184,01/05/2021,01-05-2021,2021,Product 6,Clothing,California,West,  West ,"Philadelphia, California",USA,23.0,92.0,102.08,Yes,alex,0.30
1184,01/05/2021,01-05-2021,2021,Product 6,Clothing,Washington,West,  West ,"Houston, Washington",USA,18.0,72.0,89.13,No,Brooke,0.15
1185,01/05/2021,01-05-2021,2021,Product 7,Home Goods,New York,North,  North ,"Atlanta, New York",USA,36.0,360.0,505.67,Unknown,CHRIS,0.20
1185,01/05/2021,01-05-2021,2021,Product 7,Home Goods,Pennsylvania,North,  North ,"Miami, Pennsylvania",USA,21.0,210.0,300.5,Yes,Drew,0.25
1186,01/05/2021,2021/05/01,2021,Product 7,Home Goods,Texas,South,  South ,"New York City, Texas",USA,,240.0,269.58,No,Elliot,0.30
1186,01/05/2021,01-05-2021,2021,Product 7,Home Goods,Georgia,South,  South ,"Philadelphia, Georgia",USA,36.0,,530.16,Unknown,,0.15
1187,01/05/2021,01-05-2021,2021,Product 7,Home Goods,Florida,East,  East ,"Houston, Florida",USA,33.0,330.0,366.62,Yes,alex,0.20
1187,01/05/2021,01-05-2021,2021,Product 7,Home Goods,North Carolina,East,  East ,"Atlanta, North Carolina",USA,25.0,250.0,302.57,No,Brooke,0.25
1188,01/05/2021,01-05-2021,2021,Product 7,Home Goods,California,West,  West ,"Miami, California",USA,21.0,210.0,297.9,Unknown,CHRIS,0.30
1188,01/05/2021,01-05-2021,2021,Product 7,Home Goods,Washington,West,  West ,"New York City, Washington",USA,32.0,320.0,432.93,Yes,Drew,0.15
1189,01/05/2021,01-05-2021,2021,Product 8,Home Goods,New York,North,  North ,"Philadelphia, New York",USA,32.0,240.0,307.18,No,Elliot,0.20
1189,01/05/2021,01-05-2021,2021,Product 8,Home Goods,Pennsylvania,North,  North ,"Houston, Pennsylvania",USA,22.0,165.0,200.62,Unknown,,0.25
1190,01/05/2021,01-05-2021,2021,Product 8,Home Goods,Texas,South,  South ,"Atlanta, Texas",USA,35.0,262.5,374.12,Yes,alex,0.30
1190,01/05/2021,01-05-2021,2021,Product 8,Home Goods,Georgia,South,  South ,"Miami, Georgia",USA,19.0,142.5,211.29,No,Brooke,0.15
1191,01/05/2021,2021/05/01,2021,Product 8,Home Goods,Florida,East,  East ,"New York City, Florida",USA,21.0,157.5,205.44,Unknown,CHRIS,0.20
1191,01/05/2021,01-05-2021,2021,Product 8,Home Goods,North Carolina,East,  East ,"Philadelphia, North Carolina",USA,29.0,217.5,305.18,Yes,Drew,0.25
1192,01/05/2021,01-05-2021,2021,Product 8,Home Goods,California,West,  West ,"Houston, California",USA,21.0,157.5,189.3,No,Elliot,0.30
1192,01/05/2021,01-05-2021,2021,Product 8,Home Goods,Washington,West,  West ,"Atlanta, Washington",USA,35.0,262.5,374.18,Unknown,,0.15
1193,01/05/2021,01-05-2021,2021,Product 9,Home Goods,New York,North,  North ,"Miami, New York",USA,18.0,90.0,130.78,Yes,alex,0.20
1193,01/05/2021,01-05-2021,2021,Product 9,Home Goods,Pennsylvania,North,  North ,"New York City, Pennsylvania",USA,37.0,185.0,253.86,No,Brooke,0.25
1194,01/05/2021,01-05-2021,2021,Product 9,Home Goods,Texas,South,  South ,"Philadelphia, Texas",USA,20.0,100.0,138.72,Unknown,CHRIS,0.30
1194,01/05/2021,01-05-2021,2021,Product 9,Home Goods,Georgia,South,  South ,"Houston, Georgia",USA,17.0,85.0,98.59,Yes,Drew,0.15
1195,01/05/2021,01-05-2021,2021,Product 9,Home Goods,Florida,East,  East ,"Atlanta, Florida",USA,20.0,100.0,128.13,No,Elliot,0.20
1195,01/05/2021,01-05-2021,2021,Product 9,Home Goods,North Carolina,East,  East ,"Miami, North Carolina",USA,23.0,115.0,164.36,Unknown,,0.25
1196,01/05/2021,2021/05/01,2021,Product 9,Home Goods,California,West,  West ,"New York City, California",USA,28.0,140.0,160.8,Yes,alex,0.30
1196,01/05/2021,01-05-2021,2021,Product 9,Home Goods,Washington,West,  West ,"Philadelphia, Washington",USA,24.0,120.0,149.18,No,Brooke,0.15
1197,01/05/2021,01-05-2021,2021,Product 10,Home Goods,New York,North,  North ,"Houston, New York",USA,25.0,312.5,411.92,Unknown,CHRIS,0.20
1197,01/05/2021,01-05-2021,2021,Product 10,Home Goods,Pennsylvania,North,  North ,"Atlanta, Pennsylvania",USA,18.0,225.0,329.31,Yes,Drew,0.25
1198,01/05/2021,01-05-2021,2021,Product 10,Home Goods,Texas,South,  South ,"Miami, Texas",USA,22.0,275.0,387.93,No,Elliot,0.30
1198,01/05/2021,01-05-2021,2021,Product 10,Home Goods,Georgia,South,  South ,"New York City, Georgia",USA,37.0,462.5,553.3,Unknown,,0.15
1199,01/05/2021,01-05-2021,2021,Product 10,Home Goods,Florida,East,  East ,"Philadelphia, Florida",USA,32.0,400.0,500.48,Yes,alex,0.20
1199,01/05/2021,01-05-2021,2021,Product 10,Home Goods,North Carolina,East,  East ,"Houston, North Carolina",USA,28.0,350.0,451.42,No,Brooke,0.25
1200,01/05/2021,01-05-2021,2021,Product 10,Home Goods,California,West,  West ,"Atlanta, California",USA,25.0,312.5,411.05,Unknown,CHRIS,0.30
1200,01/05/2021,01-05-2021,2021,Product 10,Home Goods,Washington,West,  West ,"Miami, Washington",USA,27.0,337.5,468.12,Yes,Drew,0.15
1201,01/06/2021,2021/06/01,2021,Product 1,Electronics,New York,North,  North ,"New York City, New York",USA,28.0,700.0,864.59,No,Elliot,0.20
1201,01/06/2021,01-06-2021,2021,Product 1,Electronics,Pennsylvania,North,  North ,"Philadelphia, Pennsylvania",USA,34.0,850.0,1210.52,Unknown,,0.25
1202,01/06/2021,01-06-2021,2021,Product 1,Electronics,Texas,South,  South ,"Houston, Texas",USA,35.0,875.0,1306.38,Yes,alex,0.30
1202,01/06/2021,01-06-2021,2021,Product 1,Electronics,Georgia,South,  South ,"Atlanta, Georgia",USA,23.0,575.0,780.26,No,Brooke,0.15
1203,01/06/2021,01-06-2021,2021,Product 1,Electronics,Florida,East,  East ,"Miami, Florida",USA,36.0,900.0,ERROR,Unknown,CHRIS,0.20
1203,01/06/2021,01-06-2021,2021,Product 1,Electronics,North Carolina,East,  East ,"New York City, North Carolina",USA,27.0,675.0,933.34,Yes,Drew,0.25
1204,01/06/2021,01-06-2021,2021,Product 1,Electronics,California,West,  West ,"Philadelphia, California",USA,33.0,825.0,1006.16,No,Elliot,0.30
1204,01/06/2021,01-06-2021,2021,Product 1,Electronics,Washington,West,  West ,"Houston, Washington",USA,,675.0,776.85,Unknown,,0.15
1205,01/06/2021,01-06-2021,2021,Product 2,Electronics,New York,North,  North ,"Atlanta, New York",USA,31.0,465.0,615.49,Yes,alex,0.20
1205,01/06/2021,01-06-2021,2021,Product 2,Electronics,Pennsylvania,North,  North ,"Miami, Pennsylvania",USA,18.0,270.0,344.32,No,Brooke,0.25
1206,01/06/2021,2021/06/01,2021,Product 2,Electronics,Texas,South,  South ,"New York City, Texas",USA,31.0,465.0,651.85,Unknown,CHRIS,0.30
1206,01/06/2021,01-06-2021,2021,Product 2,Electronics,Georgia,South,  South ,"Philadelphia, Georgia",USA,19.0,285.0,359.46,Yes,Drew,0.15
1207,01/06/2021,01-06-2021,2021,Product 2,Electronics,Florida,East,  East ,"Houston, Florida",USA,28.0,420.0,575.76,No,Elliot,0.20
1207,01/06/2021,01-06-2021,2021,Product 2,Electronics,North Carolina,East,  East ,"Atlanta, North Carolina",USA,18.0,270.0,311.85,Unknown,,0.25
1208,01/06/2021,01-06-2021,2021,Product 2,Electronics,California,West,  West ,"Miami, California",USA,37.0,555.0,748.32,Yes,alex,0.30
1208,01/06/2021,01-06-2021,2021,Product 2,Electronics,Washington,West,  West ,"New York City, Washington",USA,37.0,555.0,781.08,No,Brooke,0.15
1209,01/06/2021,01-06-2021,2021,Product 3,Electronics,New York,North,  North ,"Philadelphia, New York",USA,37.0,1850.0,2737.83,Unknown,CHRIS,0.20
1209,01/06/2021,01-06-2021,2021,Product 3,Electronics,Pennsylvania,North,  North ,"Houston, Pennsylvania",USA,24.0,1200.0,1601.94,Yes,Drew,0.25
1210,01/06/2021,01-06-2021,2021,Product 3,Electronics,Texas,South,  South ,"Atlanta, Texas",USA,32.0,1600.0,2354.39,No,Elliot,0.30
1210,01/06/2021,01-06-2021,2021,Product 3,Electronics,Georgia,South,  South ,"Miami, Georgia",USA,19.0,950.0,1346.73,Unknown,,0.15
1211,01/06/2021,2021/06/01,2021,Product 3,Electronics,Florida,East,  East ,"New York City, Florida",USA,35.0,1750.0,2346.37,Yes,alex,0.20
1211,01/06/2021,01-06-2021,2021,Product 3,Electronics,North Carolina,East,  East ,"Philadelphia, North Carolina",USA,33.0,1650.0,2060.64,No,Brooke,0.25
1212,01/06/2021,01-06-2021,2021,Product 3,Electronics,California,West,  West ,"Houston, California",USA,20.0,1000.0,1342.64,Unknown,CHRIS,0.30
1212,01/06/2021,01-06-2021,2021,Product 3,Electronics,Washington,West,  West ,"Atlanta, Washington",USA,18.0,900.0,1115.86,Yes,Drew,0.15
1213,01/06/2021,01-06-2021,2021,Product 4,Clothing,New York,North,  North ,"Miami, New York",USA,31.0,,91.37,No,Elliot,0.20
1213,01/06/2021,01-06-2021,2021,Product 4,Clothing,Pennsylvania,North,  North ,"New York City, Pennsylvania",USA,35.0,87.5,114.37,Unknown,,0.25
1214,01/06/2021,01-06-2021,2021,Product 4,Clothing,Texas,South,  South ,"Philadelphia, Texas",USA,18.0,45.0,60.58,Yes,alex,0.30
1214,01/06/2021,01-06-2021,2021,Product 4,Clothing,Georgia,South,  South ,"Houston, Georgia",USA,33.0,82.5,93.05,No,Brooke,0.15
1215,01/06/2021,01-06-2021,2021,Product 4,Clothing,Florida,East,  East ,"Atlanta, Florida",USA,26.0,65.0,74.13,Unknown,CHRIS,0.20
1215,01/06/2021,01-06-2021,2021,Product 4,Clothing,North Carolina,East,  East ,"Miami, North Carolina",USA,33.0,82.5,100.84,Yes,Drew,0.25
1216,01/06/2021,2021/06/01,2021,Product 4,Clothing,California,West,  West ,"New York City, California",USA,30.0,75.0,89.05,No,Elliot,0.30
1216,01/06/2021,01-06-2021,2021,Product 4,Clothing,Washington,West,  West ,"Philadelphia, Washington",USA,36.0,90.0,107.17,Unknown,,0.15
1217,01/06/2021,01-06-2021,2021,Product 5,Clothing,New York,North,  North ,"Houston, New York",USA,30.0,45.0,52.75,Yes,alex,0.20
1217,01/06/2021,01-06-2021,2021,Product 5,Clothing,Pennsylvania,North,  North ,"Atlanta, Pennsylvania",USA,30.0,45.0,57.8,No,Brooke,0.25
1218,01/06/2021,01-06-2021,2021,Product 5,Clothing,Texas,South,  South ,"Miami, Texas",USA,30.0,45.0,52.22,Unknown,CHRIS,0.30
1218,01/06/2021,01-06-2021,2021,Product 5,Clothing,Georgia,South,  South ,"New York City, Georgia",USA,21.0,31.5,41.0,Yes,Drew,0.15
1219,01/06/2021,01-06-2021,2021,Product 5,Clothing,Florida,East,  East ,"Philadelphia, Florida",USA,33.0,49.5,63.58,No,Elliot,0.20
1219,01/06/2021,01-06-2021,2021,Product 5,Clothing,North Carolina,East,  East ,"Houston, North Carolina",USA,20.0,30.0,41.76,Unknown,,0.25
1220,01/06/2021,01-06-2021,2021,Product 5,Clothing,California,West,  West ,"Atlanta, California",USA,20.0,30.0,37.07,Yes,alex,0.30
1220,01/06/2021,01-06-2021,2021,Product 5,Clothing,Washington,West,  West ,"Miami, Washington",USA,20.0,30.0,44.59,No,Brooke,0.15
1221,01/06/2021,2021/06/01,2021,Product 6,Clothing,New York,North,  North ,"New York City, New York",USA,26.0,104.0,146.36,Unknown,CHRIS,0.20
1221,01/06/2021,01-06-2021,2021,Product 6,Clothing,Pennsylvania,North,  North ,"Philadelphia, Pennsylvania",USA,25.0,100.0,115.99,Yes,Drew,0.25
1222,01/06/2021,01-06-2021,2021,Product 6,Clothing,Texas,South,  South ,"Houston, Texas",USA,23.0,92.0,129.42,No,Elliot,0.30
1222,01/06/2021,01-06-2021,2021,Product 6,Clothing,Georgia,South,  South ,"Atlanta, Georgia",USA,18.0,72.0,100.13,Unknown,,0.15
1223,01/06/2021,01-06-2021,2021,Product 6,Clothing,Florida,East,  East ,"Miami, Florida",USA,,132.0,147.41,Yes,alex,0.20
1223,01/06/2021,01-06-2021,2021,Product 6,Clothing,North Carolina,East,  East ,"New York City, North Carolina",USA,18.0,72.0,88.11,No,Brooke,0.25
1224,01/06/2021,01-06-2021,2021,Product 6,Clothing,California,West,  West ,"Philadelphia, California",USA,33.0,132.0,150.39,Unknown,CHRIS,0.30
1224,01/06/2021,01-06-2021,2021,Product 6,Clothing,Washington,West,  West ,"Houston, Washington",USA,34.0,136.0,164.25,Yes,Drew,0.15
1225,01/06/2021,01-06-2021,2021,Product 7,Home Goods,New York,North,  North ,"Atlanta, New York",USA,22.0,220.0,319.6,No,Elliot,0.20
1225,01/06/2021,01-06-2021,2021,Product 7,Home Goods,Pennsylvania,North,  North ,"Miami, Pennsylvania",USA,35.0,350.0,474.61,Unknown,,0.25
1226,01/06/2021,2021/06/01,2021,Product 7,Home Goods,Texas,South,  South ,"New York City, Texas",USA,20.0,200.0,245.8,Yes,alex,0.30
1226,01/06/2021,01-06-2021,2021,Product 7,Home Goods,Georgia,South,  South ,"Philadelphia, Georgia",USA,22.0,220.0,287.04,No,Brooke,0.15
1227,01/06/2021,01-06-2021,2021,Product 7,Home Goods,Florida,East,  East ,"Houston, Florida",USA,25.0,250.0,303.79,Unknown,CHRIS,0.20
1227,01/06/2021,01-06-2021,2021,Product 7,Home Goods,North Carolina,East,  East ,"Atlanta, North Carolina",USA,36.0,360.0,406.84,Yes,Drew,0.25
1228,01/06/2021,01-06-2021,2021,Product 7,Home Goods,California,West,  West ,"Miami, California",USA,33.0,330.0,442.95,No,Elliot,0.30
1228,01/06/2021,01-06-2021,2021,Product 7,Home Goods,Washington,West,  West ,"New York City, Washington",USA,21.0,210.0,254.41,Unknown,,0.15
1229,01/06/2021,01-06-2021,2021,Product 8,Home Goods,New York,North,  North ,"Philadelphia, New York",USA,21.0,157.5,225.36,Yes,alex,0.20
1229,01/06/2021,01-06-2021,2021,Product 8,Home Goods,Pennsylvania,North,  North ,"Houston, Pennsylvania",USA,21.0,157.5,229.44,No,Brooke,0.25
1230,01/06/2021,01-06-2021,2021,Product 8,Home Goods,Texas,South,  South ,"Atlanta, Texas",USA,31.0,232.5,292.43,Unknown,CHRIS,0.30
1230,01/06/2021,01-06-2021,2021,Product 8,Home Goods,Georgia,South,  South ,"Miami, Georgia",USA,31.0,232.5,343.48,Yes,Drew,0.15
1231,01/06/2021,2021/06/01,2021,Product 8,Home Goods,Florida,East,  East ,"New York City, Florida",USA,29.0,217.5,301.03,No,Elliot,0.20
1231,01/06/2021,01-06-2021,2021,Product 8,Home Goods,North Carolina,East,  East ,"Philadelphia, North Carolina",USA,18.0,135.0,176.54,Unknown,,0.25
1232,01/06/2021,01-06-2021,2021,Product 8,Home Goods,California,West,  West ,"Houston, California",USA,29.0,217.5,283.45,Yes,alex,0.30
1232,01/06/2021,01-06-2021,2021,Product 8,Home Goods,Washington,West,  West ,"Atlanta, Washington",USA,20.0,150.0,212.63,No,Brooke,0.15
1233,01/06/2021,01-06-2021,2021,Product 9,Home Goods,New York,North,  North ,"Miami, New York",USA,20.0,100.0,120.75,Unknown,CHRIS,0.20
1233,01/06/2021,01-06-2021,2021,Product 9,Home Goods,Pennsylvania,North,  North ,"New York City, Pennsylvania",USA,27.0,135.0,183.84,Yes,Drew,0.25
1234,01/06/2021,01-06-2021,2021,Product 9,Home Goods,Texas,South,  South ,"Philadelphia, Texas",USA,36.0,180.0,228.37,No,Elliot,0.30
1234,01/06/2021,01-06-2021,2021,Product 9,Home Goods,Georgia,South,  South ,"Houston, Georgia",USA,26.0,130.0,144.91,Unknown,,0.15
1235,01/06/2021,01-06-2021,2021,Product 9,Home Goods,Florida,East,  East ,"Atlanta, Florida",USA,20.0,100.0,119.57,Yes,alex,0.20
1235,01/06/2021,01-06-2021,2021,Product 9,Home Goods,North Carolina,East,  East ,"Miami, North Carolina",USA,23.0,115.0,141.5,No,Brooke,0.25
1236,01/06/2021,2021/06/01,2021,Product 9,Home Goods,California,West,  West ,"New York City, California",USA,34.0,170.0,216.61,Unknown,CHRIS,0.30
1236,01/06/2021,01-06-2021,2021,Product 9,Home Goods,Washington,West,  West ,"Philadelphia, Washington",USA,24.0,120.0,144.0,Yes,Drew,0.15
1237,01/06/2021,01-06-2021,2021,Product 10,Home Goods,New York,North,  North ,"Houston, New York",USA,29.0,362.5,493.72,No,Elliot,0.20
1237,01/06/2021,01-06-2021,2021,Product 10,Home Goods,Pennsylvania,North,  North ,"Atlanta, Pennsylvania",USA,37.0,462.5,681.95,Unknown,,0.25
1238,01/06/2021,01-06-2021,2021,Product 10,Home Goods,Texas,South,  South ,"Miami, Texas",USA,28.0,350.0,497.55,Yes,alex,0.30
1238,01/06/2021,01-06-2021,2021,Product 10,Home Goods,Georgia,South,  South ,"New York City, Georgia",USA,37.0,462.5,674.77,No,Brooke,0.15
1239,01/06/2021,01-06-2021,2021,Product 10,Home Goods,Florida,East,  East ,"Philadelphia, Florida",USA,19.0,237.5,272.22,Unknown,CHRIS,0.20
1239,01/06/2021,01-06-2021,2021,Product 10,Home Goods,North Carolina,East,  East ,"Houston, North Carolina",USA,23.0,,353.09,Yes,Drew,0.25
1240,01/06/2021,01-06-2021,2021,Product 10,Home Goods,California,West,  West ,"Atlanta, California",USA,25.0,312.5,460.56,No,Elliot,0.30
1240,01/06/2021,01-06-2021,2021,Product 10,Home Goods,Washington,West,  West ,"Miami, Washington",USA,37.0,462.5,610.95,Unknown,,0.15
1241,01/07/2021,2021/07/01,2021,Product 1,Electronics,New York,North,  North ,"New York City, New York",USA,19.0,475.0,525.92,Yes,alex,0.20
1241,01/07/2021,01-07-2021,2021,Product 1,Electronics,Pennsylvania,North,  North ,"Philadelphia, Pennsylvania",USA,,775.0,976.92,No,Brooke,0.25
1242,01/07/2021,01-07-2021,2021,Product 1,Electronics,Texas,South,  South ,"Houston, Texas",USA,27.0,675.0,820.3,Unknown,CHRIS,0.30
1242,01/07/2021,01-07-2021,2021,Product 1,Electronics,Georgia,South,  South ,"Atlanta, Georgia",USA,30.0,750.0,851.02,Yes,Drew,0.15
1243,01/07/2021,01-07-2021,2021,Product 1,Electronics,Florida,East,  East ,"Miami, Florida",USA,30.0,750.0,859.36,No,Elliot,0.20
1243,01/07/2021,01-07-2021,2021,Product 1,Electronics,North Carolina,East,  East ,"New York City, North Carolina",USA,38.0,950.0,1105.28,Unknown,,0.25
1244,01/07/2021,01-07-2021,2021,Product 1,Electronics,California,West,  West ,"Philadelphia, California",USA,33.0,825.0,1007.28,Yes,alex,0.30
1244,01/07/2021,01-07-2021,2021,Product 1,Electronics,Washington,West,  West ,"Houston, Washington",USA,35.0,875.0,1188.64,No,Brooke,0.15
1245,01/07/2021,01-07-2021,2021,Product 2,Electronics,New York,North,  North ,"Atlanta, New York",USA,26.0,390.0,573.73,Unknown,CHRIS,0.20
1245,01/07/2021,01-07-2021,2021,Product 2,Electronics,Pennsylvania,North,  North ,"Miami, Pennsylvania",USA,19.0,285.0,387.33,Yes,Drew,0.25
1246,01/07/2021,2021/07/01,2021,Product 2,Electronics,Texas,South,  South ,"New York City, Texas",USA,36.0,540.0,751.83,No,Elliot,0.30
1246,01/07/2021,01-07-2021,2021,Product 2,Electronics,Georgia,South,  South ,"Philadelphia, Georgia",USA,21.0,315.0,372.64,Unknown,,0.15
1247,01/07/2021,01-07-2021,2021,Product 2,Electronics,Florida,East,  East ,"Houston, Florida",USA,22.0,330.0,406.12,Yes,alex,0.20
1247,01/07/2021,01-07-2021,2021,Product 2,Electronics,North Carolina,East,  East ,"Atlanta, North Carolina",USA,32.0,480.0,577.43,No,Brooke,0.25
1248,01/07/2021,01-07-2021,2021,Product 2,Electronics,California,West,  West ,"Miami, California",USA,35.0,525.0,669.36,Unknown,CHRIS,0.30
1248,01/07/2021,01-07-2021,2021,Product 2,Electronics,Washington,West,  West ,"New York City, Washington",USA,35.0,525.0,751.86,Yes,Drew,0.15
1249,01/07/2021,01-07-2021,2021,Product 3,Electronics,New York,North,  North ,"Philadelphia, New York",USA,31.0,1550.0,1719.68,No,Elliot,0.20
1249,01/07/2021,01-07-2021,2021,Product 3,Electronics,Pennsylvania,North,  North ,"Houston, Pennsylvania",USA,28.0,1400.0,1771.07,Unknown,,0.25
1250,01/07/2021,01-07-2021,2021,Product 3,Electronics,Texas,South,  South ,"Atlanta, Texas",USA,28.0,1400.0,1772.59,Yes,alex,0.30
1250,01/07/2021,01-07-2021,2021,Product 3,Electronics,Georgia,South,  South ,"Miami, Georgia",USA,20.0,1000.0,1435.95,No,Brooke,0.15
1251,01/07/2021,2021/07/01,2021,Product 3,Electronics,Florida,East,  East ,"New York City, Florida",USA,32.0,1600.0,2275.37,Unknown,CHRIS,0.20
1251,01/07/2021,01-07-2021,2021,Product 3,Electronics,North Carolina,East,  East ,"Philadelphia, North Carolina",USA,33.0,1650.0,2284.49,Yes,Drew,0.25
1252,01/07/2021,01-07-2021,2021,Product 3,Electronics,California,West,  West ,"Houston, California",USA,33.0,1650.0,2176.18,No,Elliot,0.30
1252,01/07/2021,01-07-2021,2021,Product 3,Electronics,Washington,West,  West ,"Atlanta, Washington",USA,24.0,1200.0,1484.96,Unknown,,0.15
1253,01/07/2021,01-07-2021,2021,Product 4,Clothing,New York,North,  North ,"Miami, New York",USA,23.0,57.5,75.3,Yes,alex,0.20
1253,01/07/2021,01-07-2021,2021,Product 4,Clothing,Pennsylvania,North,  North ,"New York City, Pennsylvania",USA,34.0,85.0,ERROR,No,Brooke,0.25
1254,01/07/2021,01-07-2021,2021,Product 4,Clothing,Texas,South,  South ,"Philadelphia, Texas",USA,28.0,70.0,82.68,Unknown,CHRIS,0.30
1254,01/07/2021,01-07-2021,2021,Product 4,Clothing,Georgia,South,  South ,"Houston, Georgia",USA,34.0,85.0,117.46,Yes,Drew,0.15
1255,01/07/2021,01-07-2021,2021,Product 4,Clothing,Florida,East,  East ,"Atlanta, Florida",USA,27.0,67.5,93.29,No,Elliot,0.20
1255,01/07/2021,01-07-2021,2021,Product 4,Clothing,North Carolina,East,  East ,"Miami, North Carolina",USA,22.0,55.0,69.03,Unknown,,0.25
1256,01/07/2021,2021/07/01,2021,Product 4,Clothing,California,West,  West ,"New York City, California",USA,33.0,82.5,111.94,Yes,alex,0.30
1256,01/07/2021,01-07-2021,2021,Product 4,Clothing,Washington,West,  West ,"Philadelphia, Washington",USA,36.0,90.0,108.31,No,Brooke,0.15
1257,01/07/2021,01-07-2021,2021,Product 5,Clothing,New York,North,  North ,"Houston, New York",USA,28.0,42.0,55.1,Unknown,CHRIS,0.20
1257,01/07/2021,01-07-2021,2021,Product 5,Clothing,Pennsylvania,North,  North ,"Atlanta, Pennsylvania",USA,36.0,54.0,60.39,Yes,Drew,0.25
1258,01/07/2021,01-07-2021,2021,Product 5,Clothing,Texas,South,  South ,"Miami, Texas",USA,37.0,55.5,73.75,No,Elliot,0.30
1258,01/07/2021,01-07-2021,2021,Product 5,Clothing,Georgia,South,  South ,"New York City, Georgia",USA,28.0,42.0,48.29,Unknown,,0.15
1259,01/07/2021,01-07-2021,2021,Product 5,Clothing,Florida,East,  East ,"Philadelphia, Florida",USA,24.0,36.0,44.27,Yes,alex,0.20
1259,01/07/2021,01-07-2021,2021,Product 5,Clothing,North Carolina,East,  East ,"Houston, North Carolina",USA,26.0,39.0,52.15,No,Brooke,0.25
1260,01/07/2021,01-07-2021,2021,Product 5,Clothing,California,West,  West ,"Atlanta, California",USA,,55.5,64.34,Unknown,CHRIS,0.30
1260,01/07/2021,01-07-2021,2021,Product 5,Clothing,Washington,West,  West ,"Miami, Washington",USA,25.0,37.5,50.68,Yes,Drew,0.15
1261,01/07/2021,2021/07/01,2021,Product 6,Clothing,New York,North,  North ,"New York City, New York",USA,33.0,132.0,158.71,No,Elliot,0.20
1261,01/07/2021,01-07-2021,2021,Product 6,Clothing,Pennsylvania,North,  North ,"Philadelphia, Pennsylvania",USA,37.0,148.0,203.32,Unknown,,0.25
1262,01/07/2021,01-07-2021,2021,Product 6,Clothing,Texas,South,  South ,"Houston, Texas",USA,23.0,92.0,134.57,Yes,alex,0.30
1262,01/07/2021,01-07-2021,2021,Product 6,Clothing,Georgia,South,  South ,"Atlanta, Georgia",USA,29.0,116.0,159.01,No,Brooke,0.15
1263,01/07/2021,01-07-2021,2021,Product 6,Clothing,Florida,East,  East ,"Miami, Florida",USA,28.0,112.0,150.56,Unknown,CHRIS,0.20
1263,01/07/2021,01-07-2021,2021,Product 6,Clothing,North Carolina,East,  East ,"New York City, North Carolina",USA,31.0,124.0,185.65,Yes,Drew,0.25
1264,01/07/2021,01-07-2021,2021,Product 6,Clothing,California,West,  West ,"Philadelphia, California",USA,33.0,132.0,159.72,No,Elliot,0.30
1264,01/07/2021,01-07-2021,2021,Product 6,Clothing,Washington,West,  West ,"Houston, Washington",USA,34.0,136.0,169.49,Unknown,,0.15
1265,01/07/2021,01-07-2021,2021,Product 7,Home Goods,New York,North,  North ,"Atlanta, New York",USA,26.0,260.0,308.84,Yes,alex,0.20
1265,01/07/2021,01-07-2021,2021,Product 7,Home Goods,Pennsylvania,North,  North ,"Miami, Pennsylvania",USA,27.0,270.0,380.41,No,Brooke,0.25
1266,01/07/2021,2021/07/01,2021,Product 7,Home Goods,Texas,South,  South ,"New York City, Texas",USA,21.0,,235.5,Unknown,CHRIS,0.30
1266,01/07/2021,01-07-2021,2021,Product 7,Home Goods,Georgia,South,  South ,"Philadelphia, Georgia",USA,24.0,240.0,298.23,Yes,Drew,0.15
1267,01/07/2021,01-07-2021,2021,Product 7,Home Goods,Florida,East,  East ,"Houston, Florida",USA,30.0,300.0,448.69,No,Elliot,0.20
1267,01/07/2021,01-07-2021,2021,Product 7,Home Goods,North Carolina,East,  East ,"Atlanta, North Carolina",USA,20.0,200.0,279.1,Unknown,,0.25
1268,01/07/2021,01-07-2021,2021,Product 7,Home Goods,California,West,  West ,"Miami, California",USA,23.0,230.0,333.52,Yes,alex,0.30
1268,01/07/2021,01-07-2021,2021,Product 7,Home Goods,Washington,West,  West ,"New York City, Washington",USA,33.0,330.0,391.39,No,Brooke,0.15
1269,01/07/2021,01-07-2021,2021,Product 8,Home Goods,New York,North,  North ,"Philadelphia, New York",USA,21.0,157.5,173.35,Unknown,CHRIS,0.20
1269,01/07/2021,01-07-2021,2021,Product 8,Home Goods,Pennsylvania,North,  North ,"Houston, Pennsylvania",USA,33.0,247.5,281.79,Yes,Drew,0.25
1270,01/07/2021,01-07-2021,2021,Product 8,Home Goods,Texas,South,  South ,"Atlanta, Texas",USA,28.0,210.0,292.43,No,Elliot,0.30
1270,01/07/2021,01-07-2021,2021,Product 8,Home Goods,Georgia,South,  South ,"Miami, Georgia",USA,18.0,135.0,166.08,Unknown,,0.15
1271,01/07/2021,2021/07/01,2021,Product 8,Home Goods,Florida,East,  East ,"New York City, Florida",USA,21.0,157.5,179.65,Yes,alex,0.20
1271,01/07/2021,01-07-2021,2021,Product 8,Home Goods,North Carolina,East,  East ,"Philadelphia, North Carolina",USA,35.0,262.5,304.27,No,Brooke,0.25
1272,01/07/2021,01-07-2021,2021,Product 8,Home Goods,California,West,  West ,"Houston, California",USA,37.0,277.5,352.41,Unknown,CHRIS,0.30
1272,01/07/2021,01-07-2021,2021,Product 8,Home Goods,Washington,West,  West ,"Atlanta, Washington",USA,32.0,240.0,312.77,Yes,Drew,0.15
1273,01/07/2021,01-07-2021,2021,Product 9,Home Goods,New York,North,  North ,"Miami, New York",USA,25.0,125.0,157.82,No,Elliot,0.20
1273,01/07/2021,01-07-2021,2021,Product 9,Home Goods,Pennsylvania,North,  North ,"New York City, Pennsylvania",USA,36.0,180.0,201.56,Unknown,,0.25
1274,01/07/2021,01-07-2021,2021,Product 9,Home Goods,Texas,South,  South ,"Philadelphia, Texas",USA,35.0,175.0,196.73,Yes,alex,0.30
1274,01/07/2021,01-07-2021,2021,Product 9,Home Goods,Georgia,South,  South ,"Houston, Georgia",USA,25.0,125.0,172.51,No,Brooke,0.15
1275,01/07/2021,01-07-2021,2021,Product 9,Home Goods,Florida,East,  East ,"Atlanta, Florida",USA,20.0,100.0,145.52,Unknown,CHRIS,0.20
1275,01/07/2021,01-07-2021,2021,Product 9,Home Goods,North Carolina,East,  East ,"Miami, North Carolina",USA,24.0,120.0,153.3,Yes,Drew,0.25
1276,01/07/2021,2021/07/01,2021,Product 9,Home Goods,California,West,  West ,"New York City, California",USA,35.0,175.0,254.5,No,Elliot,0.30
1276,01/07/2021,01-07-2021,2021,Product 9,Home Goods,Washington,West,  West ,"Philadelphia, Washington",USA,20.0,100.0,140.97,Unknown,,0.15
1277,01/07/2021,01-07-2021,2021,Product 10,Home Goods,New York,North,  North ,"Houston, New York",USA,24.0,300.0,375.66,Yes,alex,0.20
1277,01/07/2021,01-07-2021,2021,Product 10,Home Goods,Pennsylvania,North,  North ,"Atlanta, Pennsylvania",USA,36.0,450.0,534.43,No,Brooke,0.25
1278,01/07/2021,01-07-2021,2021,Product 10,Home Goods,Texas,South,  South ,"Miami, Texas",USA,20.0,250.0,342.34,Unknown,CHRIS,0.30
1278,01/07/2021,01-07-2021,2021,Product 10,Home Goods,Georgia,South,  South ,"New York City, Georgia",USA,,300.0,432.44,Yes,Drew,0.15
1279,01/07/2021,01-07-2021,2021,Product 10,Home Goods,Florida,East,  East ,"Philadelphia, Florida",USA,28.0,350.0,388.99,No,Elliot,0.20
1279,01/07/2021,01-07-2021,2021,Product 10,Home Goods,North Carolina,East,  East ,"Houston, North Carolina",USA,25.0,312.5,463.15,Unknown,,0.25
1280,01/07/2021,01-07-2021,2021,Product 10,Home Goods,California,West,  West ,"Atlanta, California",USA,25.0,312.5,394.32,Yes,alex,0.30
1280,01/07/2021,01-07-2021,2021,Product 10,Home Goods,Washington,West,  West ,"Miami, Washington",USA,37.0,462.5,665.14,No,Brooke,0.15
1281,01/08/2021,2021/08/01,2021,Product 1,Electronics,New York,North,  North ,"New York City, New York",USA,33.0,825.0,977.75,Unknown,CHRIS,0.20
1281,01/08/2021,01-08-2021,2021,Product 1,Electronics,Pennsylvania,North,  North ,"Philadelphia, Pennsylvania",USA,21.0,525.0,582.15,Yes,Drew,0.25
1282,01/08/2021,01-08-2021,2021,Product 1,Electronics,Texas,South,  South ,"Houston, Texas",USA,33.0,825.0,1092.39,No,Elliot,0.30
1282,01/08/2021,01-08-2021,2021,Product 1,Electronics,Georgia,South,  South ,"Atlanta, Georgia",USA,34.0,850.0,1032.73,Unknown,,0.15
1283,01/08/2021,01-08-2021,2021,Product 1,Electronics,Florida,East,  East ,"Miami, Florida",USA,32.0,800.0,947.16,Yes,alex,0.20
1283,01/08/2021,01-08-2021,2021,Product 1,Electronics,North Carolina,East,  East ,"New York City, North Carolina",USA,37.0,925.0,1383.54,No,Brooke,0.25
1284,01/08/2021,01-08-2021,2021,Product 1,Electronics,California,West,  West ,"Philadelphia, California",USA,27.0,675.0,835.04,Unknown,CHRIS,0.30
1284,01/08/2021,01-08-2021,2021,Product 1,Electronics,Washington,West,  West ,"Houston, Washington",USA,29.0,725.0,810.08,Yes,Drew,0.15
1285,01/08/2021,01-08-2021,2021,Product 2,Electronics,New York,North,  North ,"Atlanta, New York",USA,28.0,420.0,561.67,No,Elliot,0.20
1285,01/08/2021,01-08-2021,2021,Product 2,Electronics,Pennsylvania,North,  North ,"Miami, Pennsylvania",USA,22.0,330.0,400.03,Unknown,,0.25
1286,01/08/2021,2021/08/01,2021,Product 2,Electronics,Texas,South,  South ,"New York City, Texas",USA,35.0,525.0,631.69,Yes,alex,0.30
1286,01/08/2021,01-08-2021,2021,Product 2,Electronics,Georgia,South,  South ,"Philadelphia, Georgia",USA,35.0,525.0,610.65,No,Brooke,0.15
1287,01/08/2021,01-08-2021,2021,Product 2,Electronics,Florida,East,  East ,"Houston, Florida",USA,19.0,285.0,390.43,Unknown,CHRIS,0.20
1287,01/08/2021,01-08-2021,2021,Product 2,Electronics,North Carolina,East,  East ,"Atlanta, North Carolina",USA,32.0,480.0,595.18,Yes,Drew,0.25
1288,01/08/2021,01-08-2021,2021,Product 2,Electronics,California,West,  West ,"Miami, California",USA,32.0,480.0,640.46,No,Elliot,0.30
1288,01/08/2021,01-08-2021,2021,Product 2,Electronics,Washington,West,  West ,"New York City, Washington",USA,30.0,450.0,603.45,Unknown,,0.15
1289,01/08/2021,01-08-2021,2021,Product 3,Electronics,New York,North,  North ,"Philadelphia, New York",USA,37.0,1850.0,2713.08,Yes,alex,0.20
1289,01/08/2021,01-08-2021,2021,Product 3,Electronics,Pennsylvania,North,  North ,"Houston, Pennsylvania",USA,35.0,1750.0,2106.55,No,Brooke,0.25
1290,01/08/2021,01-08-2021,2021,Product 3,Electronics,Texas,South,  South ,"Atlanta, Texas",USA,23.0,1150.0,1452.53,Unknown,CHRIS,0.30
1290,01/08/2021,01-08-2021,2021,Product 3,Electronics,Georgia,South,  South ,"Miami, Georgia",USA,37.0,1850.0,2242.68,Yes,Drew,0.15
1291,01/08/2021,2021/08/01,2021,Product 3,Electronics,Florida,East,  East ,"New York City, Florida",USA,35.0,1750.0,2133.38,No,Elliot,0.20
1291,01/08/2021,01-08-2021,2021,Product 3,Electronics,North Carolina,East,  East ,"Philadelphia, North Carolina",USA,35.0,1750.0,2487.41,Unknown,,0.25
1292,01/08/2021,01-08-2021,2021,Product 3,Electronics,California,West,  West ,"Houston, California",USA,20.0,1000.0,1180.33,Yes,alex,0.30
1292,01/08/2021,01-08-2021,2021,Product 3,Electronics,Washington,West,  West ,"Atlanta, Washington",USA,24.0,,1635.05,No,Brooke,0.15
1293,01/08/2021,01-08-2021,2021,Product 4,Clothing,New York,North,  North ,"Miami, New York",USA,31.0,77.5,91.0,Unknown,CHRIS,0.20
1293,01/08/2021,01-08-2021,2021,Product 4,Clothing,Pennsylvania,North,  North ,"New York City, Pennsylvania",USA,21.0,52.5,69.52,Yes,Drew,0.25
1294,01/08/2021,01-08-2021,2021,Product 4,Clothing,Texas,South,  South ,"Philadelphia, Texas",USA,23.0,57.5,77.72,No,Elliot,0.30
1294,01/08/2021,01-08-2021,2021,Product 4,Clothing,Georgia,South,  South ,"Houston, Georgia",USA,36.0,90.0,111.52,Unknown,,0.15
1295,01/08/2021,01-08-2021,2021,Product 4,Clothing,Florida,East,  East ,"Atlanta, Florida",USA,33.0,82.5,94.2,Yes,alex,0.20
1295,01/08/2021,01-08-2021,2021,Product 4,Clothing,North Carolina,East,  East ,"Miami, North Carolina",USA,26.0,65.0,96.7,No,Brooke,0.25
1296,01/08/2021,2021/08/01,2021,Product 4,Clothing,California,West,  West ,"New York City, California",USA,29.0,72.5,97.58,Unknown,CHRIS,0.30
1296,01/08/2021,01-08-2021,2021,Product 4,Clothing,Washington,West,  West ,"Philadelphia, Washington",USA,19.0,47.5,70.81,Yes,Drew,0.15
1297,01/08/2021,01-08-2021,2021,Product 5,Clothing,New York,North,  North ,"Houston, New York",USA,,42.0,54.05,No,Elliot,0.20
1297,01/08/2021,01-08-2021,2021,Product 5,Clothing,Pennsylvania,North,  North ,"Atlanta, Pennsylvania",USA,33.0,49.5,65.03,Unknown,,0.25
1298,01/08/2021,01-08-2021,2021,Product 5,Clothing,Texas,South,  South ,"Miami, Texas",USA,34.0,51.0,74.98,Yes,alex,0.30
1298,01/08/2021,01-08-2021,2021,Product 5,Clothing,Georgia,South,  South ,"New York City, Georgia",USA,35.0,52.5,67.18,No,Brooke,0.15
1299,01/08/2021,01-08-2021,2021,Product 5,Clothing,Florida,East,  East ,"Philadelphia, Florida",USA,20.0,30.0,40.2,Unknown,CHRIS,0.20
1299,01/08/2021,01-08-2021,2021,Product 5,Clothing,North Carolina,East,  East ,"Houston, North Carolina",USA,19.0,28.5,40.38,Yes,Drew,0.25
1300,01/08/2021,01-08-2021,2021,Product 5,Clothing,California,West,  West ,"Atlanta, California",USA,27.0,40.5,45.73,No,Elliot,0.30
1300,01/08/2021,01-08-2021,2021,Product 5,Clothing,Washington,West,  West ,"Miami, Washington",USA,37.0,55.5,79.72,Unknown,,0.15
1301,01/08/2021,2021/08/01,2021,Product 6,Clothing,New York,North,  North ,"New York City, New York",USA,26.0,104.0,129.66,Yes,alex,0.20
1301,01/08/2021,01-08-2021,2021,Product 6,Clothing,Pennsylvania,North,  North ,"Philadelphia, Pennsylvania",USA,20.0,80.0,102.4,No,Brooke,0.25
1302,01/08/2021,01-08-2021,2021,Product 6,Clothing,Texas,South,  South ,"Houston, Texas",USA,30.0,120.0,170.07,Unknown,CHRIS,0.30
1302,01/08/2021,01-08-2021,2021,Product 6,Clothing,Georgia,South,  South ,"Atlanta, Georgia",USA,19.0,76.0,112.11,Yes,Drew,0.15
1303,01/08/2021,01-08-2021,2021,Product 6,Clothing,Florida,East,  East ,"Miami, Florida",USA,24.0,96.0,138.83,No,Elliot,0.20
1303,01/08/2021,01-08-2021,2021,Product 6,Clothing,North Carolina,East,  East ,"New York City, North Carolina",USA,25.0,100.0,128.75,Unknown,,0.25
1304,01/08/2021,01-08-2021,2021,Product 6,Clothing,California,West,  West ,"Philadelphia, California",USA,21.0,84.0,ERROR,Yes,alex,0.30
1304,01/08/2021,01-08-2021,2021,Product 6,Clothing,Washington,West,  West ,"Houston, Washington",USA,32.0,128.0,182.5,No,Brooke,0.15
1305,01/08/2021,01-08-2021,2021,Product 7,Home Goods,New York,North,  North ,"Atlanta, New York",USA,30.0,300.0,405.38,Unknown,CHRIS,0.20
1305,01/08/2021,01-08-2021,2021,Product 7,Home Goods,Pennsylvania,North,  North ,"Miami, Pennsylvania",USA,31.0,310.0,447.2,Yes,Drew,0.25
1306,01/08/2021,2021/08/01,2021,Product 7,Home Goods,Texas,South,  South ,"New York City, Texas",USA,25.0,250.0,315.29,No,Elliot,0.30
1306,01/08/2021,01-08-2021,2021,Product 7,Home Goods,Georgia,South,  South ,"Philadelphia, Georgia",USA,27.0,270.0,369.8,Unknown,,0.15
1307,01/08/2021,01-08-2021,2021,Product 7,Home Goods,Florida,East,  East ,"Houston, Florida",USA,28.0,280.0,384.75,Yes,alex,0.20
1307,01/08/2021,01-08-2021,2021,Product 7,Home Goods,North Carolina,East,  East ,"Atlanta, North Carolina",USA,27.0,270.0,387.97,No,Brooke,0.25
1308,01/08/2021,01-08-2021,2021,Product 7,Home Goods,California,West,  West ,"Miami, California",USA,38.0,380.0,492.01,Unknown,CHRIS,0.30
1308,01/08/2021,01-08-2021,2021,Product 7,Home Goods,Washington,West,  West ,"New York City, Washington",USA,28.0,280.0,409.66,Yes,Drew,0.15
1309,01/08/2021,01-08-2021,2021,Product 8,Home Goods,New York,North,  North ,"Philadelphia, New York",USA,38.0,285.0,403.46,No,Elliot,0.20
1309,01/08/2021,01-08-2021,2021,Product 8,Home Goods,Pennsylvania,North,  North ,"Houston, Pennsylvania",USA,19.0,142.5,165.46,Unknown,,0.25
1310,01/08/2021,01-08-2021,2021,Product 8,Home Goods,Texas,South,  South ,"Atlanta, Texas",USA,29.0,217.5,263.13,Yes,alex,0.30
1310,01/08/2021,01-08-2021,2021,Product 8,Home Goods,Georgia,South,  South ,"Miami, Georgia",USA,24.0,180.0,232.26,No,Brooke,0.15
1311,01/08/2021,2021/08/01,2021,Product 8,Home Goods,Florida,East,  East ,"New York City, Florida",USA,30.0,225.0,262.21,Unknown,CHRIS,0.20
1311,01/08/2021,01-08-2021,2021,Product 8,Home Goods,North Carolina,East,  East ,"Philadelphia, North Carolina",USA,31.0,232.5,274.92,Yes,Drew,0.25
1312,01/08/2021,01-08-2021,2021,Product 8,Home Goods,California,West,  West ,"Houston, California",USA,34.0,255.0,346.58,No,Elliot,0.30
1312,01/08/2021,01-08-2021,2021,Product 8,Home Goods,Washington,West,  West ,"Atlanta, Washington",USA,32.0,240.0,264.69,Unknown,,0.15
1313,01/08/2021,01-08-2021,2021,Product 9,Home Goods,New York,North,  North ,"Miami, New York",USA,29.0,145.0,164.88,Yes,alex,0.20
1313,01/08/2021,01-08-2021,2021,Product 9,Home Goods,Pennsylvania,North,  North ,"New York City, Pennsylvania",USA,37.0,185.0,265.91,No,Brooke,0.25
1314,01/08/2021,01-08-2021,2021,Product 9,Home Goods,Texas,South,  South ,"Philadelphia, Texas",USA,25.0,125.0,170.49,Unknown,CHRIS,0.30
1314,01/08/2021,01-08-2021,2021,Product 9,Home Goods,Georgia,South,  South ,"Houston, Georgia",USA,24.0,120.0,171.99,Yes,Drew,0.15
1315,01/08/2021,01-08-2021,2021,Product 9,Home Goods,Florida,East,  East ,"Atlanta, Florida",USA,24.0,120.0,137.38,No,Elliot,0.20
1315,01/08/2021,01-08-2021,2021,Product 9,Home Goods,North Carolina,East,  East ,"Miami, North Carolina",USA,,95.0,134.39,Unknown,,0.25
1316,01/08/2021,2021/08/01,2021,Product 9,Home Goods,California,West,  West ,"New York City, California",USA,23.0,115.0,145.93,Yes,alex,0.30
1316,01/08/2021,01-08-2021,2021,Product 9,Home Goods,Washington,West,  West ,"Philadelphia, Washington",USA,29.0,145.0,162.2,No,Brooke,0.15
1317,01/08/2021,01-08-2021,2021,Product 10,Home Goods,New York,North,  North ,"Houston, New York",USA,38.0,475.0,566.21,Unknown,CHRIS,0.20
1317,01/08/2021,01-08-2021,2021,Product 10,Home Goods,Pennsylvania,North,  North ,"Atlanta, Pennsylvania",USA,34.0,425.0,599.05,Yes,Drew,0.25
1318,01/08/2021,01-08-2021,2021,Product 10,Home Goods,Texas,South,  South ,"Miami, Texas",USA,32.0,400.0,562.89,No,Elliot,0.30
1318,01/08/2021,01-08-2021,2021,Product 10,Home Goods,Georgia,South,  South ,"New York City, Georgia",USA,29.0,362.5,408.66,Unknown,,0.15
1319,01/08/2021,01-08-2021,2021,Product 10,Home Goods,Florida,East,  East ,"Philadelphia, Florida",USA,20.0,,332.68,Yes,alex,0.20
1319,01/08/2021,01-08-2021,2021,Product 10,Home Goods,North Carolina,East,  East ,"Houston, North Carolina",USA,34.0,425.0,489.98,No,Brooke,0.25
1320,01/08/2021,01-08-2021,2021,Product 10,Home Goods,California,West,  West ,"Atlanta, California",USA,25.0,312.5,352.59,Unknown,CHRIS,0.30
1320,01/08/2021,01-08-2021,2021,Product 10,Home Goods,Washington,West,  West ,"Miami, Washington",USA,24.0,300.0,384.4,Yes,Drew,0.15
1321,01/09/2021,2021/09/01,2021,Product 1,Electronics,New York,North,  North ,"New York City, New York",USA,24.0,600.0,787.81,No,Elliot,0.20
1321,01/09/2021,01-09-2021,2021,Product 1,Electronics,Pennsylvania,North,  North ,"Philadelphia, Pennsylvania",USA,28.0,700.0,939.21,Unknown,,0.25
1322,01/09/2021,01-09-2021,2021,Product 1,Electronics,Texas,South,  South ,"Houston, Texas",USA,32.0,800.0,1016.9,Yes,alex,0.30
1322,01/09/2021,01-09-2021,2021,Product 1,Electronics,Georgia,South,  South ,"Atlanta, Georgia",USA,30.0,750.0,1097.87,No,Brooke,0.15
1323,01/09/2021,01-09-2021,2021,Product 1,Electronics,Florida,East,  East ,"Miami, Florida",USA,27.0,675.0,819.9,Unknown,CHRIS,0.20
1323,01/09/2021,01-09-2021,2021,Product 1,Electronics,North Carolina,East,  East ,"New York City, North Carolina",USA,29.0,725.0,1026.2,Yes,Drew,0.25
1324,01/09/2021,01-09-2021,2021,Product 1,Electronics,California,West,  West ,"Philadelphia, California",USA,22.0,550.0,702.15,No,Elliot,0.30
1324,01/09/2021,01-09-2021,2021,Product 1,Electronics,Washington,West,  West ,"Houston, Washington",USA,35.0,875.0,1222.9,Unknown,,0.15
1325,01/09/2021,01-09-2021,2021,Product 2,Electronics,New York,North,  North ,"Atlanta, New York",USA,34.0,510.0,615.84,Yes,alex,0.20
1325,01/09/2021,01-09-2021,2021,Product 2,Electronics,Pennsylvania,North,  North ,"Miami, Pennsylvania",USA,19.0,285.0,347.98,No,Brooke,0.25
1326,01/09/2021,2021/09/01,2021,Product 2,Electronics,Texas,South,  South ,"New York City, Texas",USA,36.0,540.0,621.8,Unknown,CHRIS,0.30
1326,01/09/2021,01-09-2021,2021,Product 2,Electronics,Georgia,South,  South ,"Philadelphia, Georgia",USA,39.0,585.0,719.76,Yes,Drew,0.15
1327,01/09/2021,01-09-2021,2021,Product 2,Electronics,Florida,East,  East ,"Houston, Florida",USA,27.0,405.0,603.05,No,Elliot,0.20
1327,01/09/2021,01-09-2021,2021,Product 2,Electronics,North Carolina,East,  East ,"Atlanta, North Carolina",USA,33.0,495.0,608.14,Unknown,,0.25
1328,01/09/2021,01-09-2021,2021,Product 2,Electronics,California,West,  West ,"Miami, California",USA,25.0,375.0,489.21,Yes,alex,0.30
1328,01/09/2021,01-09-2021,2021,Product 2,Electronics,Washington,West,  West ,"New York City, Washington",USA,22.0,330.0,433.44,No,Brooke,0.15
1329,01/09/2021,01-09-2021,2021,Product 3,Electronics,New York,North,  North ,"Philadelphia, New York",USA,25.0,1250.0,1517.31,Unknown,CHRIS,0.20
1329,01/09/2021,01-09-2021,2021,Product 3,Electronics,Pennsylvania,North,  North ,"Houston, Pennsylvania",USA,30.0,1500.0,1929.53,Yes,Drew,0.25
1330,01/09/2021,01-09-2021,2021,Product 3,Electronics,Texas,South,  South ,"Atlanta, Texas",USA,21.0,1050.0,1235.62,No,Elliot,0.30
1330,01/09/2021,01-09-2021,2021,Product 3,Electronics,Georgia,South,  South ,"Miami, Georgia",USA,33.0,1650.0,2111.88,Unknown,,0.15
1331,01/09/2021,2021/09/01,2021,Product 3,Electronics,Florida,East,  East ,"New York City, Florida",USA,33.0,1650.0,1842.94,Yes,alex,0.20
1331,01/09/2021,01-09-2021,2021,Product 3,Electronics,North Carolina,East,  East ,"Philadelphia, North Carolina",USA,27.0,1350.0,1636.26,No,Brooke,0.25
1332,01/09/2021,01-09-2021,2021,Product 3,Electronics,California,West,  West ,"Houston, California",USA,34.0,1700.0,1935.65,Unknown,CHRIS,0.30
1332,01/09/2021,01-09-2021,2021,Product 3,Electronics,Washington,West,  West ,"Atlanta, Washington",USA,28.0,1400.0,1946.45,Yes,Drew,0.15
1333,01/09/2021,01-09-2021,2021,Product 4,Clothing,New York,North,  North ,"Miami, New York",USA,33.0,82.5,114.37,No,Elliot,0.20
1333,01/09/2021,01-09-2021,2021,Product 4,Clothing,Pennsylvania,North,  North ,"New York City, Pennsylvania",USA,38.0,95.0,139.24,Unknown,,0.25
1334,01/09/2021,01-09-2021,2021,Product 4,Clothing,Texas,South,  South ,"Philadelphia, Texas",USA,,82.5,94.0,Yes,alex,0.30
1334,01/09/2021,01-09-2021,2021,Product 4,Clothing,Georgia,South,  South ,"Houston, Georgia",USA,32.0,80.0,108.08,No,Brooke,0.15
1335,01/09/2021,01-09-2021,2021,Product 4,Clothing,Florida,East,  East ,"Atlanta, Florida",USA,26.0,65.0,80.0,Unknown,CHRIS,0.20
1335,01/09/2021,01-09-2021,2021,Product 4,Clothing,North Carolina,East,  East ,"Miami, North Carolina",USA,33.0,82.5,101.27,Yes,Drew,0.25
1336,01/09/2021,2021/09/01,2021,Product 4,Clothing,California,West,  West ,"New York City, California",USA,33.0,82.5,96.29,No,Elliot,0.30
1336,01/09/2021,01-09-2021,2021,Product 4,Clothing,Washington,West,  West ,"Philadelphia, Washington",USA,25.0,62.5,71.75,Unknown,,0.15
1337,01/09/2021,01-09-2021,2021,Product 5,Clothing,New York,North,  North ,"Houston, New York",USA,25.0,37.5,53.21,Yes,alex,0.20
1337,01/09/2021,01-09-2021,2021,Product 5,Clothing,Pennsylvania,North,  North ,"Atlanta, Pennsylvania",USA,27.0,40.5,48.56,No,Brooke,0.25
1338,01/09/2021,01-09-2021,2021,Product 5,Clothing,Texas,South,  South ,"Miami, Texas",USA,33.0,49.5,59.46,Unknown,CHRIS,0.30
1338,01/09/2021,01-09-2021,2021,Product 5,Clothing,Georgia,South,  South ,"New York City, Georgia",USA,31.0,46.5,63.56,Yes,Drew,0.15
1339,01/09/2021,01-09-2021,2021,Product 5,Clothing,Florida,East,  East ,"Philadelphia, Florida",USA,25.0,37.5,49.62,No,Elliot,0.20
1339,01/09/2021,01-09-2021,2021,Product 5,Clothing,North Carolina,East,  East ,"Houston, North Carolina",USA,28.0,42.0,48.25,Unknown,,0.25
1340,01/09/2021,01-09-2021,2021,Product 5,Clothing,California,West,  West ,"Atlanta, California",USA,35.0,52.5,60.2,Yes,alex,0.30
1340,01/09/2021,01-09-2021,2021,Product 5,Clothing,Washington,West,  West ,"Miami, Washington",USA,20.0,30.0,33.75,No,Brooke,0.15
1341,01/09/2021,2021/09/01,2021,Product 6,Clothing,New York,North,  North ,"New York City, New York",USA,23.0,92.0,114.59,Unknown,CHRIS,0.20
1341,01/09/2021,01-09-2021,2021,Product 6,Clothing,Pennsylvania,North,  North ,"Philadelphia, Pennsylvania",USA,25.0,100.0,145.35,Yes,Drew,0.25
1342,01/09/2021,01-09-2021,2021,Product 6,Clothing,Texas,South,  South ,"Houston, Texas",USA,24.0,96.0,138.5,No,Elliot,0.30
1342,01/09/2021,01-09-2021,2021,Product 6,Clothing,Georgia,South,  South ,"Atlanta, Georgia",USA,26.0,104.0,144.58,Unknown,,0.15
1343,01/09/2021,01-09-2021,2021,Product 6,Clothing,Florida,East,  East ,"Miami, Florida",USA,29.0,116.0,136.86,Yes,alex,0.20
1343,01/09/2021,01-09-2021,2021,Product 6,Clothing,North Carolina,East,  East ,"New York City, North Carolina",USA,37.0,148.0,221.29,No,Brooke,0.25
1344,01/09/2021,01-09-2021,2021,Product 6,Clothing,California,West,  West ,"Philadelphia, California",USA,39.0,156.0,171.8,Unknown,CHRIS,0.30
1344,01/09/2021,01-09-2021,2021,Product 6,Clothing,Washington,West,  West ,"Houston, Washington",USA,39.0,156.0,200.51,Yes,Drew,0.15
1345,01/09/2021,01-09-2021,2021,Product 7,Home Goods,New York,North,  North ,"Atlanta, New York",USA,29.0,290.0,388.14,No,Elliot,0.20
1345,01/09/2021,01-09-2021,2021,Product 7,Home Goods,Pennsylvania,North,  North ,"Miami, Pennsylvania",USA,38.0,,494.17,Unknown,,0.25
1346,01/09/2021,2021/09/01,2021,Product 7,Home Goods,Texas,South,  South ,"New York City, Texas",USA,30.0,300.0,365.69,Yes,alex,0.30
1346,01/09/2021,01-09-2021,2021,Product 7,Home Goods,Georgia,South,  South ,"Philadelphia, Georgia",USA,31.0,310.0,462.65,No,Brooke,0.15
1347,01/09/2021,01-09-2021,2021,Product 7,Home Goods,Florida,East,  East ,"Houston, Florida",USA,38.0,380.0,430.22,Unknown,CHRIS,0.20
1347,01/09/2021,01-09-2021,2021,Product 7,Home Goods,North Carolina,East,  East ,"Atlanta, North Carolina",USA,37.0,370.0,466.23,Yes,Drew,0.25
1348,01/09/2021,01-09-2021,2021,Product 7,Home Goods,California,West,  West ,"Miami, California",USA,22.0,220.0,289.2,No,Elliot,0.30
1348,01/09/2021,01-09-2021,2021,Product 7,Home Goods,Washington,West,  West ,"New York City, Washington",USA,23.0,230.0,336.12,Unknown,,0.15
1349,01/09/2021,01-09-2021,2021,Product 8,Home Goods,New York,North,  North ,"Philadelphia, New York",USA,22.0,165.0,192.07,Yes,alex,0.20
1349,01/09/2021,01-09-2021,2021,Product 8,Home Goods,Pennsylvania,North,  North ,"Houston, Pennsylvania",USA,25.0,187.5,272.78,No,Brooke,0.25
1350,01/09/2021,01-09-2021,2021,Product 8,Home Goods,Texas,South,  South ,"Atlanta, Texas",USA,30.0,225.0,270.0,Unknown,CHRIS,0.30
1350,01/09/2021,01-09-2021,2021,Product 8,Home Goods,Georgia,South,  South ,"Miami, Georgia",USA,26.0,195.0,225.46,Yes,Drew,0.15
1351,01/09/2021,2021/09/01,2021,Product 8,Home Goods,Florida,East,  East ,"New York City, Florida",USA,34.0,255.0,282.19,No,Elliot,0.20
1351,01/09/2021,01-09-2021,2021,Product 8,Home Goods,North Carolina,East,  East ,"Philadelphia, North Carolina",USA,31.0,232.5,280.17,Unknown,,0.25
1352,01/09/2021,01-09-2021,2021,Product 8,Home Goods,California,West,  West ,"Houston, California",USA,27.0,202.5,227.22,Yes,alex,0.30
1352,01/09/2021,01-09-2021,2021,Product 8,Home Goods,Washington,West,  West ,"Atlanta, Washington",USA,,172.5,204.09,No,Brooke,0.15
1353,01/09/2021,01-09-2021,2021,Product 9,Home Goods,New York,North,  North ,"Miami, New York",USA,25.0,125.0,141.0,Unknown,CHRIS,0.20
1353,01/09/2021,01-09-2021,2021,Product 9,Home Goods,Pennsylvania,North,  North ,"New York City, Pennsylvania",USA,35.0,175.0,228.91,Yes,Drew,0.25
1354,01/09/2021,01-09-2021,2021,Product 9,Home Goods,Texas,South,  South ,"Philadelphia, Texas",USA,19.0,95.0,109.98,No,Elliot,0.30
1354,01/09/2021,01-09-2021,2021,Product 9,Home Goods,Georgia,South,  South ,"Houston, Georgia",USA,26.0,130.0,ERROR,Unknown,,0.15
1355,01/09/2021,01-09-2021,2021,Product 9,Home Goods,Florida,East,  East ,"Atlanta, Florida",USA,24.0,120.0,150.3,Yes,alex,0.20
1355,01/09/2021,01-09-2021,2021,Product 9,Home Goods,North Carolina,East,  East ,"Miami, North Carolina",USA,23.0,115.0,158.77,No,Brooke,0.25
1356,01/09/2021,2021/09/01,2021,Product 9,Home Goods,California,West,  West ,"New York City, California",USA,23.0,115.0,129.01,Unknown,CHRIS,0.30
1356,01/09/2021,01-09-2021,2021,Product 9,Home Goods,Washington,West,  West ,"Philadelphia, Washington",USA,34.0,170.0,248.31,Yes,Drew,0.15
1357,01/09/2021,01-09-2021,2021,Product 10,Home Goods,New York,North,  North ,"Houston, New York",USA,27.0,337.5,462.72,No,Elliot,0.20
1357,01/09/2021,01-09-2021,2021,Product 10,Home Goods,Pennsylvania,North,  North ,"Atlanta, Pennsylvania",USA,25.0,312.5,353.32,Unknown,,0.25
1358,01/09/2021,01-09-2021,2021,Product 10,Home Goods,Texas,South,  South ,"Miami, Texas",USA,19.0,237.5,286.6,Yes,alex,0.30
1358,01/09/2021,01-09-2021,2021,Product 10,Home Goods,Georgia,South,  South ,"New York City, Georgia",USA,36.0,450.0,573.34,No,Brooke,0.15
1359,01/09/2021,01-09-2021,2021,Product 10,Home Goods,Florida,East,  East ,"Philadelphia, Florida",USA,35.0,437.5,510.0,Unknown,CHRIS,0.20
1359,01/09/2021,01-09-2021,2021,Product 10,Home Goods,North Carolina,East,  East ,"Houston, North Carolina",USA,37.0,462.5,566.81,Yes,Drew,0.25
1360,01/09/2021,01-09-2021,2021,Product 10,Home Goods,California,West,  West ,"Atlanta, California",USA,38.0,475.0,657.97,No,Elliot,0.30
1360,01/09/2021,01-09-2021,2021,Product 10,Home Goods,Washington,West,  West ,"Miami, Washington",USA,29.0,362.5,450.45,Unknown,,0.15
1361,01/10/2021,2021/10/01,2021,Product 1,Electronics,New York,North,  North ,"New York City, New York",USA,37.0,925.0,1226.07,Yes,alex,0.20
1361,01/10/2021,01-10-2021,2021,Product 1,Electronics,Pennsylvania,North,  North ,"Philadelphia, Pennsylvania",USA,37.0,925.0,1261.53,No,Brooke,0.25
1362,01/10/2021,01-10-2021,2021,Product 1,Electronics,Texas,South,  South ,"Houston, Texas",USA,21.0,525.0,595.11,Unknown,CHRIS,0.30
1362,01/10/2021,01-10-2021,2021,Product 1,Electronics,Georgia,South,  South ,"Atlanta, Georgia",USA,24.0,600.0,713.4,Yes,Drew,0.15
1363,01/10/2021,01-10-2021,2021,Product 1,Electronics,Florida,East,  East ,"Miami, Florida",USA,20.0,500.0,620.36,No,Elliot,0.20
1363,01/10/2021,01-10-2021,2021,Product 1,Electronics,North Carolina,East,  East ,"New York City, North Carolina",USA,36.0,900.0,1331.2,Unknown,,0.25
1364,01/10/2021,01-10-2021,2021,Product 1,Electronics,California,West,  West ,"Philadelphia, California",USA,25.0,625.0,814.55,Yes,alex,0.30
1364,01/10/2021,01-10-2021,2021,Product 1,Electronics,Washington,West,  West ,"Houston, Washington",USA,36.0,900.0,1119.2,No,Brooke,0.15
1365,01/10/2021,01-10-2021,2021,Product 2,Electronics,New York,North,  North ,"Atlanta, New York",USA,34.0,510.0,629.58,Unknown,CHRIS,0.20
1365,01/10/2021,01-10-2021,2021,Product 2,Electronics,Pennsylvania,North,  North ,"Miami, Pennsylvania",USA,27.0,405.0,554.58,Yes,Drew,0.25
1366,01/10/2021,2021/10/01,2021,Product 2,Electronics,Texas,South,  South ,"New York City, Texas",USA,38.0,570.0,829.18,No,Elliot,0.30
